,Sentences
1984,"Kant, it is well known, was deeply influenced in his opinions upon ethics and law by the speculations of Rousseau."
1985,"Kant, Rousseau, and the Massachusetts Bill of Rights agree that all men are born free and equal, and one or the other branch of that declaration has afforded the answer to the question why possession should be protected from that day to this."
1986,Kant and Hegel start from freedom.
1987,"The freedom of the will, Kant said, is the essence of man."
1988,"It is an end in itself; it is that which needs no further explanation, which is absolutely to be respected, and which it is the very end and object of all government to realize and affirm."
1989,Possession is to be protected because a man by taking possession of an object has brought it within the sphere of his will.
1990,He has extended his personality into or over that object.
1991,"As Hegel would have said, possession is the objective realization of free will."
1992,"And by Kant's postulate, the will of any individual thus manifested is entitled to absolute respect from every other individual, and can only be overcome or set aside by the universal will, that is, by the state, acting through its organs, the courts."
1993,Savigny did not follow Kant on this point.
1994,"He said that every act of violence is unlawful, and seemed to consider protection of possession a branch of protection to the person."
1995,"/ But to this it was answered that possession was protected against disturbance by fraud as well as by force, and his view is discredited."
1996,"Those who have been contented with humble grounds of expediency seem to have been few in number, and have recanted or are out of favor."
1997,The majority have followed in the direction pointed out by Kant.
1998,"Bruns, an admirable writer, expresses a characteristic yearning of the German mind, when he demands an internal juristic necessity drawn from the nature of possession itself, and therefore rejects empirical reasons."
1999,"/ He finds the necessity he seeks in the freedom of the human will, which the whole legal system does but recognize and carry out."
2000,"Constraint of it is a wrong, which must be righted without regard to conformity of the will to law, and so on in a Kantian vein."
2001,"/ So Gans, a favorite disciple of Hegel, The will is of itself a substantial thing to be protected, and this individual will has only to yield to the higher common will."
2002,"/ So Puchta, a great master, The will which wills itself, that is, the recognition of its own personality, is to be protected."
2003,"/ The chief variation from this view is that of Windscheid, a writer now in vogue."
2004,He prefers the other branch of the declaration in the Bill of Rights.
2005,"He thinks that the protection to possession stands on the same grounds as protection against injuria, that every one is the equal of every other in the state, and that no one shall raise himself over the other."
2006,"/ Ihering, to be sure, a man of genius, took an independent start, and said that possession is ownership on the defensive; and that, in favor of the owner, he who is exercising ownership in fact is freed from the necessity of proving title against one who is in an unlawful position."
2007,"But to this it was well answered by Bruns, in his later work, that it assumes the title of disseisors to be generally worse than that of disseisees, which cannot be taken for granted, and which probably is not true in fact."
2008,"/ It follows from the Kantian doctrine, that a man in possession is to be confirmed and maintained in it until he is put out by an action brought for the purpose."
2009,"Perhaps another fact besides those which have been mentioned has influenced this reasoning, and that is the accurate division between possessory and petitory actions or defences in Continental procedure."
2010,"/ When a defendant in a possessory action is not allowed to set up title in himself, a theorist readily finds a mystical importance in possession."
2011,But when does a man become entitled to this absolute protection
2012,"On the principle of Kant, it is not enough that he has the custody of a thing."
2013,"A protection based on the sacredness of man's personality requires that the object should have been brought within the sphere of that personality, that the free will should have unrestrainedly set itself into that object."
2014,"There must be then an intent to appropriate it, that is, to make it part of one's self, or one's own."
2015,Here the prevailing view of the Roman law comes in to fortify principle with precedent.
2016,"We are told that, of the many who might have the actual charge or custody of a thing, the Roman law recognized as possessor only the owner, or one holding as owner and on his way to become one by lapse of time."
2017,In later days it made a few exceptions on practical grounds.
2018,But beyond the pledgee and the sequester these exceptions are unimportant and disputed.
2019,/ Some of the Roman jurists state in terms that depositaries and borrowers have not possession of the things intrusted to them.
2020,"/ Whether the German interpretation of the sources goes too far or not, it must be taken account of in the examination of German theories."
2021,"Philosophy by denying possession to bailees in general cunningly adjusted itself to the Roman law, and thus put itself in a position to claim the authority of that law for the theory of which the mode of dealing with bailees was merely a corollary."
2022,"Hence I say that it is important to show that a far more developed, more rational, and mightier body of law than the Roman, gives no sanction to either premise or conclusion as held by Kant and his successors."
2023,"In the first place, the English law has always had the good sense / to allow title to be set up in defence to a possessory action."
2024,"In the assize of novel disseisin, which which was a true possessory action, the defendant could always rely on his title."
2025,"/ Even when possession is taken or kept in a way which is punished by the criminal law, as in case of forcible entry and detainer, proof of title allows the defendant to retain it, and in many cases has been held an answer to an action of trespass."
2026,So in trespass for taking goods the defendant may set up title in himself.
2027,"There might seem to be a trace of the distinction in the general rule, that the title cannot be tried in trespass quare clausum."
2028,"But this is an exception commonly put on the ground that the judgment cannot change the property, as trespass for chattels or trover can."
2029,"/ The rule that you cannot go into title in a possessory action presupposes great difficulty in the proof, the probatio diabolica of the Canon law, delays in the process, and importance of possession ad interim, all of which mark a stage of society which has long been passed."
2030,"In ninety nine cases out of a hundred, it is about as easy and cheap to prove at least a prima facie title as it is to prove possession."
2031,"In the next place, and this was the importance of the last Lecture to this subject, the common law has always given the possessory remedies to all bailees without exception."
2032,"The right to these remedies extends not only to pledgees, lessees, and those having a lien, who exclude their bailor, but to simple bailees, as they have been called, who have no interest in the chattels, no right of detention as against the owner, and neither give nor receive a reward."
2033,/ Modern German statutes have followed in the same path so far as to give the possessory remedies to tenants and some others.
2034,"Bruns says, as the spirit of the Kantian theory required him to say, that this is a sacrifice of principle to convenience."
2035,/ But I cannot see what is left of a principle which avows itself inconsistent with convenience and the actual course of legislation.
2036,The first call of a theory of law is that it should fit the facts.
2037,It must explain the observed course of legislation.
2038,"And as it is pretty certain that men will make laws which seem to them convenient without troubling themselves very much what principles are encountered by their legislation, a principle which defies convenience is likely to wait some time before it finds itself permanently realized."
2039,"It remains, then, to seek for some ground for the protection of possession outside the Bill of Rights or the Declaration of Independence, which shall be consistent with the larger scope given to the conception in modern law."
2040,The courts have said but little on the subject.
2041,"It was laid down in one case that it was an extension of the protection which the law throws around the person, and on that ground held that trespass quare clausum did not pass to an assignee in bankruptcy."
2042,"/ So it has been said, that to deny a bankrupt trover against strangers for goods coming to his possession after his bankruptcy would be an invitation to all the world to scramble for the possession of them ; and reference was made to grounds of policy and convenience."
2043,"/ I may also refer to the cases of capture, some of which will be cited again."
2044,"In the Greenland whale fishery, by the English custom, if the first striker lost his hold on the fish, and it was then killed by another, the first had no claim; but he had the whole if he kept fast to the whale until it was struck by the other, although it then broke from the first harpoon."
2045,"By the custom in the Gallipagos, on the other hand, the first striker had half the whale, although control of the line was lost."
2046,"/ Each of these customs has been sustained and acted on by the English courts, and Judge Lowell has decided in accordance with still a third, which gives the whale to the vessel whose iron first remains in it, provided claim be made before cutting in."
2047,"/ The ground as put by Lord Mansfield is simply that, were it not for such customs, there must be a sort of warfare perpetually subsisting between the adventurers."
2048,"/ If courts adopt different rules on similar facts, according to the point at which men will fight in the several cases, it tends, so far as it goes, to shake an a priori theory of the matter."
2049,"Those who see in the history of law the formal expression of the development of society will be apt to think that the proximate ground of law must be empirical, even when that ground is the fact that a certain ideal or theory of government is generally entertained."
2050,"Law, being a practical thing, must found itself on actual forces."
2051,"It is quite enough, therefore, for the law, that man, by an instinct which he shares with the domestic dog, and of which the seal gives a most striking example, will not allow himself to be dispossessed, either by force or fraud, of what he holds, without trying to get it back again."
2052,"/ Philosophy may find a hundred reasons to justify the instinct, but it would be totally immaterial if it should condemn it and bid us surrender without a murmur."
2053,"As long as the instinct remains, it will be more comfortable for the law to satisfy it in an orderly manner, than to leave people to themselves."
2054,"If it should do otherwise, it would become a matter for pedagogues, wholly devoid of reality."
2055,I think we are now in a position to begin the analysis of possession.
2056,It will be instructive to say a word in the first place upon a preliminary question which has been debated with much zeal in Germany.
2057,Is possession a fact or a right
2058,"This question must be taken to mean, by possession and right, what the law means by those words, and not something else which philosophers or moralists may mean by them; for as lawyers we have nothing to do with either, except in a legal sense."
2059,"If this had always been borne steadily in mind, the question would hardly have been asked."
2060,"A legal right is nothing but a permission to exercise certain natural powers, and upon certain conditions to obtain protection, restitution, or compensation by the aid of the public force."
2061,"Just so far as the aid of the public force is given a man, he has a legal right, and this right is the same whether his claim is founded in righteousness or iniquity."
2062,"Just so far as possession is protected, it is as much a source of legal rights as ownership is when it secures the same protection."
2063,"Every right is a consequence attached by the law to one or more facts which the law defines, and wherever the law gives any one special rights not shared by the body of the people, it does so on the ground that certain special facts, not true of the rest of the world, are true of him."
2064,"When a group of facts thus singled out by the law exists in the case of a given person, he is said to be entitled to the corresponding rights; meaning, thereby, that the law helps him to constrain his neighbors, or some of them, in a way in which it would not, if all the facts in question were not true of him."
2065,"Hence, any word which denotes such a group of facts connotes the rights attached to it by way of legal consequences, and any word which denotes the rights attached to a group of facts connotes the group of facts in like manner."
2066,The word possession denotes such a group of facts.
2067,"Hence, when we say of a man that he has possession, we affirm directly that all the facts of a certain group are true of him, and we convey indirectly or by implication that the law will give him the advantage of the situation."
2068,"Contract, or property, or any other substantive notion of the law, may be analyzed in the same way, and should be treated in the same order."
2069,"The only difference is, that, while possession denotes the facts and connotes the consequence, property always, and contract with more uncertainty and oscillation, denote the consequence and connote the facts."
2070,"When we say that a man owns a thing, we affirm directly that he has the benefit of the consequences attached to a certain group of facts, and, by implication, that the facts are true of him."
2071,"The important thing to grasp is, that each of these legal compounds, possession, property, and contract, is to be analyzed into fact and right, antecedent and consequent, in like manner as every other."
2072,"It is wholly immaterial that one element is accented by one word, and the other by the other two."
2073,"We are not studying etymology, but law."
2074,"There are always two things to be asked: first, what are the facts which make up the group in question; and then, what are the consequences attached by the law to that group."
2075,The former generally offers the only difficulties.
2076,"Hence, it is almost tautologous to say that the protection which the law attaches by way of consequence to possession, is as truly a right in a legal sense as those consequences which are attached to adverse holding for the period of prescription, or to a promise for value or under seal."
2077,"If the statement is aided by dramatic reinforcement, I may add that possessory rights pass by descent or devise, as well as by conveyance, / and that they are taxed as property in some of the States."
2078,/ We are now ready to analyze possession as understood by the common law.
2079,"In order to discover the facts which constitute it, it will be found best to study them at the moment when possession is first gained."
2080,For then they must all be present in the same way that both consideration and promise must be present at the moment of making a contract.
2081,"But when we turn to the continuance of possessory rights, or, as is commonly said, the continuance of possession, it will be agreed by all schools that less than all the facts required to call those rights into being need continue presently true in order to keep them alive."
2082,"To gain possession, then, a man must stand in a certain physical relation to the object and to the rest of the world, and must have a certain intent."
2083,These relations and this intent are the facts of which we are in search.
2084,"The physical relation to others is simply a relation of manifested power coextensive with the intent, and will need to have but little said about it when the nature of the intent is settled."
2085,"When I come to the latter, I shall not attempt a similar analysis to that which has been pursued with regard to intent as an element of liability."
2086,"For the principles developed as to intent in that connection have no relation to the present subject, and any such analysis so far as it did not fail would be little more than a discussion of evidence."
2087,"The intent inquired into here must be overtly manifested, perhaps, but all theories of the grounds on which possession is protected would seem to agree in leading to the requirement that it should be actual, subject, of course, to the necessary limits of legal investigation."
2088,"But, besides our power and intent as towards our fellow men, there must be a certain degree of power over the object."
2089,"If there were only one other man in the world, and he was safe under lock and key in jail, the person having the key would not possess the swallows that flew over the prison."
2090,"This element is illustrated by cases of capture, although no doubt the point at which the line is drawn is affected by consideration of the degree of power obtained as against other people, as well as by that which has been gained over the object."
2091,"The Roman and the common law agree that, in general, fresh pursuit of wild animals does not give the pursuer the rights of possession."
2092,"Until escape has been made impossible by some means, another may step in and kill or catch and carry off the game if he can."
2093,"Thus it has been held that an action does not lie against a person for killing and taking a fox which had been pursued by another, and was then actually in the view of the person who had originally found, started, and chased it."
2094,"/ The Court of Queen's Bench even went so far as to decide, notwithstanding a verdict the other way, that when fish were nearly surrounded by a seine, with an opening of seven fathoms between the ends, at which point boats were stationed to frighten them from escaping, they were not reduced to possession as against a stranger who rowed in through the opening and helped himself."
2095,"/ But the difference between the power over the object which is sufficient for possession, and that which is not, is clearly one of degree only, and the line may be drawn at different places at different times on grounds just referred to."
2096,"Thus we are told that the legislature of New York enacted, in that any one who started and pursued deer in certain counties of that State should be deemed in possession of the game so long as he continued in fresh pursuit of it, / and to that extent modified the New York decisions just cited."
2097,"So, while Justinian decided that a wild beast so badly wounded that it might easily be taken must be actually taken before it belongs to the captors, / Judge Lowell, with equal reason, has upheld the contrary custom of the American whalemen in the Arctic Ocean, mentioned above, which gives a whale to the vessel whose iron first remains in it, provided claim be made before cutting in."
2098,"/ We may pass from the physical relation to the object with these few examples, because it cannot often come into consideration except in the case of living and wild things."
2099,"And so we come to the intent, which is the really troublesome matter."
2100,"It is just here that we find the German jurists unsatisfactory, for reasons which I have already explained."
2101,"The best known theories have been framed as theories of the German interpretation of the Roman law, under the influence of some form of Kantian or post Kantian philosophy."
2102,"The type of Roman possession, according to German opinion, was that of an owner, or of one on his way to become owner."
2103,"Following this out, it was said by Savigny, the only writer on the subject with whom English readers are generally acquainted, that the animus domini, or intent to deal with the thing as owner, is in general necessary to turn a mere physical detention into juridical possession."
2104,"/ We need not stop to inquire whether this modern form or the Greek characters of Theophilus / and the Greek sources is more exact; for either excludes, as the civilians and canonists do, and as the German theories must, most bailees and termors from the list of possessors."
2105,"/ The effect of this exclusion as interpreted by the Kantian philosophy of law, has been to lead the German lawyers to consider the intent necessary to possession as primarily self regarding."
2106,"Their philosophy teaches them that a man's physical power over an object is protected because he has the will to make it his, and it has thus become a part of his very self, the external manifestation of his freedom."
2107,"/ The will of the possessor being thus conceived as self regarding, the intent with which he must hold is pretty clear: he must hold for his own benefit."
2108,"Furthermore, the self regarding intent must go to the height of an intent to appropriate; for otherwise, it seems to be implied, the object would not truly be brought under the personality of the possessor."
2109,The grounds for rejecting the criteria of the Roman law have been shown above.
2110,Legal duties are logically antecedent to legal rights.
2111,"What may be their relation to moral rights if there are any, and whether moral rights are not in like manner logically the offspring of moral duties, are questions which do not concern us here."
2112,"These are for the philosopher, who approaches the law from without as part of a larger series of human manifestations."
2113,"The business of the jurist is to make known the content of the law; that is, to work upon it from within, or logically, arranging and distributing it, in order, from its stemmum genus to its infima species, so far as practicable."
2114,Legal duties then come before legal rights.
2115,"To put it more broadly, and avoid the word duty, which is open to objection, the direct working of the law is to limit freedom of action or choice on the part of a greater or less number of persons in certain specified ways; while the power of removing or enforcing this limitation which is generally confided to certain other private persons, or, in other words, a right corresponding to the burden, is not a necessary or universal correlative."
2116,"Again, a large part of the advantages enjoyed by one who has a right are not created by the law."
2117,The law does not enable me to use or abuse this book which lies before me.
2118,That is a physical power which I have without the aid of the law.
2119,What the law does is simply to prevent other men to a greater or less extent from interfering with my use or abuse.
2120,"And this analysis and example apply to the case of possession, as well as to ownership."
2121,"Such being the direct working of the law in the case of possession, one would think that the animus or intent most nearly parallel to its movement would be the intent of which we are in search."
2122,"If what the law does is to exclude others from interfering with the object, it would seem that the intent which the law should require is an intent to exclude others."
2123,"I believe that such an intent is all that the common law deems needful, and that on principle no more should be required."
2124,It may be asked whether this is not simply the animus domini looked at from the other side.
2125,"If it were, it would nevertheless be better to look at the front of the shield than at the reverse."
2126,"But it is not the same if we give to the animus domini the meaning which the Germans give it, and which denies possession to bailees in general."
2127,"The intent to appropriate or deal with a thing as owner can hardly exist without an intent to exclude others, and something more; but the latter may very well be where there is no intent to hold as owner."
2128,"A tenant for years intends to exclude all persons, including the owner, until the end of his term; yet he has not the animus domini in the sense explained."
2129,"Still less has a bailee with a lien, who does not even mean to use, but only to detain the thing for payment."
2130,"But, further, the common law protects a bailee against strangers, when it would not protect him against the owner, as in the case of a deposit or other bailment terminable at pleasure; and we may therefore say that the intent even to exclude need not be so extensive as would be implied in the animus domini."
2131,"If a bailee intends to exclude strangers to the title, it is enough for possession under our law, although he is perfectly ready to give the thing up to its owner at any moment; while it is of the essence of the German view that the intent must not be relative, but an absolute, self regarding intent to take the benefit of the thing."
2132,"Again, if the motives or wishes, and even the intentions, most present to the mind of a possessor, were all self regarding, it would not follow that the intent toward others was not the important thing in the analysis of the law."
2133,"But, as we have seen, a depositary is a true possessor under the common law theory, although his intent is not self regarding, and he holds solely for the benefit of the owner."
2134,"There is a class of cases besides those of bailees and tenants, which will probably, although not necessarily, be decided one way or the other, as we adopt the test of an intent to exclude, or of the animus domini."
2135,Bridges v. Hawkesworth / will serve as a starting point.
2136,"There, a pocket book was dropped on the floor of a shop by a customer, and picked up by another customer before the shopkeeper knew of it."
