,Sentences
952,"As action cannot be avoided, and tends to the public good, there is obviously no policy in throwing the hazard of what is at once desirable and inevitable upon the actor."
953,"The state might conceivably make itself a mutual insurance company against accidents, and distribute the burden of its citizens' mishaps among all its members."
954,"There might be a pension for paralytics, and state aid for those who suffered in person or estate from tempest or wild beasts."
955,"As between individuals it might adopt the mutual insurance principle pro tanto, and divide damages when both were in fault, as in the rusticum judicium of the admiralty, or it might throw all loss upon the actor irrespective of fault."
956,"The state does none of these things, however, and the prevailing view is that its cumbrous and expensive machinery ought not to be set in motion unless some clear benefit is to be derived from disturbing the status quo."
957,"State interference is an evil, where it cannot be shown to be a good."
958,"Universal insurance, if desired, can be better and more cheaply accomplished by private enterprise."
959,"The undertaking to redistribute losses simply on the ground that they resulted from the defendant's act would not only be open to these objections, but, as it is hoped the preceding discussion has shown, to the still graver one of offending the sense of justice."
960,"Unless my act is of a nature to threaten others, unless under the circumstances a prudent man would have foreseen the possibility of harm, it is no more justifiable to make me indemnify my neighbor against the consequences, than to make me do the same thing if I had fallen upon him in a fit, or to compel me to insure him against lightning."
961,"I must now recur to the conclusions drawn from innocent trespasses upon land, and conversions, and the supposed analogy of those cases to trespasses against the person, lest the law concerning the latter should be supposed to lie between two antinomies, each necessitating with equal cogency an opposite conclusion to the other."
962,Take first the case of trespass upon land attended by actual damage.
963,"When a man goes upon his neighbor's land, thinking it is his own, he intends the very act or consequence complained of."
964,"He means to intermeddle with a certain thing in a certain way, and it is just that intended intermeddling for which he is sued."
965,"/ Whereas, if he accidentally hits a stranger as he lifts his staff in self defence, the fact, which is the gist of the action, namely, the contact between the staff and his neighbor's head, was not intended, and could not have been foreseen."
966,"It might be answered, to be sure, that it is not for intermeddling with property, but for intermeddling with the plaintiff's property, that a man is sued; and that in the supposed cases, just as much as in that of the accidental blow, the defendant is ignorant of one of the facts making up the total environment, and which must be present to make his action wrong."
967,"He is ignorant, that is to say, that the true owner either has or claims any interest in the property in question, and therefore he does not intend a wrongful act, because he does not mean to deal with his neighbor's property."
968,"But the answer to this is, that he does intend to do the damage complained of."
969,One who diminishes the value of property by intentional damage knows it belongs to somebody.
970,"If he thinks it belongs to himself, he expects whatever harm he may do to come out of his own pocket."
971,It would be odd if he were to get rid of the burden by discovering that it belonged to his neighbor.
972,"It is a very different thing to say that he who intentionally does harm must bear the loss, from saying that one from whose acts harm follows accidentally, as a consequence which could not have been foreseen, must bear it."
973,"Next, suppose the act complained of is an exercise of dominion over the plaintiff's property, such as a merely technical trespass or a conversion."
974,"If the defendant thought that the property belonged to himself, there seems to be no abstract injustice in requiring him to know the limits of his own titles, or, if he thought that it belonged to another, in holding him bound to get proof of title before acting."
975,"Consider, too, what the defendant's liability amounts to, if the act, whether an entry upon land or a conversion of chattels, has been unattended by damage to the property, and the thing has come back to the hands of the true owner."
976,"The sum recovered is merely nominal, and the payment is nothing more than a formal acknowledgment of the owner's title; which, considering the effect of prescription and statutes of limitation upon repeated acts of dominion, is no more than right."
977,/ All semblance of injustice disappears when the defendant is allowed to avoid the costs of an action by tender or otherwise.
978,But suppose the property has not come back to the hands of the true owner.
979,"If the thing remains in the hands of the defendant, it is clearly right that he should surrender it."
980,"And if instead of the thing itself he holds the proceeds of a sale, it is as reasonable to make him pay over its value in trover or assumpsit as it would have been to compel a surrender of the thing."
981,"But the question whether the defendant has subsequently paid over the proceeds of the sale of a chattel to a third person, cannot affect the rights of the true owner of the chattel."
982,"In the supposed case of an auctioneer, for instance, if he had paid the true owner, it would have been an answer to his bailor's claim."
983,"If he has paid his bailor instead, he has paid one whom he was not bound to pay, and no general principle requires that this should be held to divest the plaintiff's right."
984,"Another consideration affecting the argument that the law as to trespasses upon property establishes a general principle, is that the defendant's knowledge or ignorance of the plaintiff's title is likely to lie wholly in his own breast, and therefore hardly admits of satisfactory proof."
985,"Indeed, in many cases it cannot have been open to evidence at all at the time when the law was settled, before parties were permitted to testify."
986,"Accordingly, in Basely v. Clarkson, / where the defence set up to an action of trespass quare clausum was that the defendant in mowing his own land involuntarily and by mistake mowed down some of the plaintiff's grass, the plaintiff had judgment on demurrer."
987,"For it appears the fact was voluntary, and his intention and knowledge are not traversable; they can't be known."
988,"This language suggests that it would be sufficient to explain the law of trespass upon property historically, without attempting to justify it."
989,For it seems to be admitted that if the defendant's mistake could be proved it might be material.
990,"/ It will be noticed, further, that any general argument from the law of trespass upon laud to that governing trespass against the person is shown to be misleading by the law as to cattle."
991,"The owner is bound at his peril to keep them off his neighbor's premises, but he is not bound at his peril in all cases to keep them from his neighbor's person."
992,"The objections to such a decision as supposed in the case of an auctioneer do not rest on the general theory of liability, but spring altogether from the special exigencies of commerce."
993,"It does not become unjust to hold a person liable for unauthorized intermeddling with another's property, until there arises the practical necessity for rapid dealing."
994,"But where this practical necessity exists, it is not surprising to find, and we do find, a different tendency in the law."
995,"The absolute protection of property, however natural to a primitive community more occupied in production than in exchange, is hardly consistent with the requirements of modern business."
996,"Even when the rules which we have been considering were established, the traffic of the public markets was governed by more liberal principles."
997,On the continent of Europe it was long ago decided that the policy of protecting titles must yield to the policy of protecting trade.
998,Casaregis held that the general principle nemo plus juris in alium transferre potest quam ipse habet must give way in mercantile transactions to possession vaut titre.
999,"/ In later times, as markets overt have lost their importance, the Factors' Acts and their successive amendments have tended more and more in the direction of adopting the Continental doctrine."
1000,"I must preface the argument from precedent with a reference to what has been said already in the first Lecture about early forms of liability, and especially about the appeals."
1001,"It was there shown that the appeals de pace et plagis and of mayhem became the action of trespass, and that those appeals and the early actions of trespass were always, so far as appears, for intentional wrongs."
1002,"/ The contra pacem in the writ of trespass was no doubt inserted to lay a foundation for the king's writ; but there seems to be no reason to attribute a similar purpose to vi et armis, or cum vi sua, as it was often put."
1003,"Glanvill says that wounds are within the sheriff's jurisdiction, unless the appellor adds a charge of breach of the king's peace."
1004,/ Yet the wounds are given vi et armis as much in the one case as in the other.
1005,"Bracton says that the lesser wrongs described by him belong to the king's jurisdiction, because they are sometimes against the peace of our lord the king, / while, as has been observed, they were supposed to be always committed intentionally."
1006,"It might even perhaps be inferred that the allegation contra pacem was originally material, and it will be remembered that trespasses formerly involved the liability to pay a fine to the king."
1007,"/ If it be true that trespass was originally confined to intentional wrongs, it is hardly necessary to consider the argument drawn from the scope of the general issue."
1008,"In form it was a mitigation of the strict denial de verbo in verbum of the ancient procedure, to which the inquest given by the king's writ was unknown."
1009,/ The strict form seems to have lasted in England some time after the trial of the issue by recognition was introduced.
1010,"/ When a recognition was granted, the inquest was, of course, only competent to speak to the facts, as has been said above."
1011,"/ When the general issue was introduced, trespass was still confined to intentional wrongs."
1012,We may now take up the authorities.
1013,It will be remembered that the earlier precedents are of a date when the assize and jurata had not given place to the modern jury.
1014,"These bodies spoke from their own knowledge to an issue defined by the writ, or to certain familiar questions of fact arising in the trial of a cause, but did not hear the whole case upon evidence adduced."
1015,"Their function was more limited than that which has been gained by the jury, and it naturally happened that, when they had declared what the defendant had done, the judges laid down the standard by which those acts were to be measured without their assistance."
1016,"Hence the question in the Year Books is not a loose or general inquiry of the jury whether they think the alleged trespasser was negligent on such facts as they may find, but a well defined issue of law, to be determined by the court, whether certain acts set forth upon the record are a ground of liability."
1017,"It is possible that the judges may have dealt pretty strictly with defendants, and it is quite easy to pass from the premise that defendants have been held trespassers for a variety of acts, without mention of neglect, to the conclusion that any act by which another was damaged will make the actor chargeable."
1018,"But a more exact scrutiny of the early books will show that liability in general, then as later, was founded on the opinion of the tribunal that the defendant ought to have acted otherwise, or, in other words, that he was to blame."
1019,"Returning first to the case of the thorns in the Year Book, / it will be seen that the falling of the thorns into the plaintiff's close, although a result not wished by the defendant, was in no other sense against his will."
1020,"When he cut the thorns, he did an act which obviously and necessarily would have that consequence, and he must be taken to have foreseen and not to have prevented it."
1021,"Choke, C. J. says, As to what was said about their falling in, ipso invito, that is no plea, but he ought to show that he could not do it in any other way, or that he did all in his power to keep them out ; and both the judges put the unlawfulness of the entry upon the plaintiff's land as a consequence of the unlawfulness of dropping the thorns there."
1022,"Choke admits that, if the thorns or a tree had been blown over upon the plaintiff's land, the defendant might have entered to get them."
1023,"Chief Justice Crew says of this case, in Millen v. Fawdry, / that the opinion was that trespass lies, because he did not plead that he did his best endeavor to hinder their falling there; yet this was a hard case."
1024,"The statements of law by counsel in argument may be left on one side, although Brian is quoted and mistaken for one of the judges by Sir William Blackstone, in Scott v. Shepherd."
1025,"The principal authorities are the shooting cases, and, as shooting is an extra hazardous act, it would not be surprising if it should be held that men do it at their peril in public places."
1026,"The liability has been put on the general ground of fault, however, wherever the line of necessary precaution may be drawn."
1027,"In Weaver v. Ward, / the defendant set up that the plaintiff and he were skirmishing in a trainband, and that when discharging his piece he wounded the plaintiff by accident and misfortune, and against his own will."
1028,"On demurrer, the court says that no man shall be excused of a trespass,... except it may be judged utterly without his fault."
1029,"As if a man by force take my hand and strike you, or if here the defendant had said, that the plaintiff ran cross his piece when it was discharging, or had set forth the case with the circumstances so as it had appeared to the court that it had been inevitable, and that the defendant had committed no negligence to give occasion to the hurt."
1030,The later cases simply follow Weaver v. Ward.
1031,"The quotations which were made above in favor of the strict doctrine from Sir T. Raymond, in Bessey v. Olliot, and from Sir William Blackstone, in Scott v. Shepherd, are both taken from dissenting opinions."
1032,"In the latter case it is pretty clear that the majority of the court considered that to repel personal danger by instantaneously tossing away a squib thrown by another upon one's stall was not a trespass, although a new motion was thereby imparted to the squib, and the plaintiff's eye was put out in consequence."
1033,"The last case cited above, in stating the arguments for absolute responsibility, was Leame v. Bray."
1034,"/ The question under discussion was whether the action should not have been case rather than trespass, the defendant founding his objection to trespass on the ground that the injury happened through his neglect, but was not done wilfully."
1035,"There was therefore no question of absolute responsibility for one's acts before the court, as negligence was admitted; and the language used is all directed simply to the proposition that the damage need not have been done intentionally."
1036,"In Wakeman v. Robinson, /another runaway case, there was evidence that the defendant pulled the wrong rein, and that he ought to have kept a straight course."
1037,"The jury were instructed that, if the injury was occasioned by an immediate act of the defendant, it was immaterial whether the act was wilful or accidental."
1038,"On motion for a new trial, Dallas, C. J. said, If the accident happened entirely without default on the part of the defendant, or blame imputable to him, the action does not lie ....The accident was clearly occasioned by the default of the defendant."
1039,The weight of evidence was all that way.
1040,"I am now called upon to grant a new trial, contrary to the justice of the case, upon the ground, that the jury were not called on to consider whether the accident was unavoidable, or occasioned by the fault of the defendant."
1041,"There can be no doubt that the learned judge who presided would have taken the opinion of the jury on that ground, if he had been requested so to do."
1042,"This language may have been inapposite under the defendant's plea , but the pleadings were not adverted to, and the doctrine is believed to be sound."
1043,In America there have been several decisions to the point.
1044,"In Brown v. Kendall, / Chief Justice Shaw settled the question for Massachusetts."
1045,"That was trespass for assault and battery, and it appeared that the defendant, while trying to separate two fighting dogs, had raised his stick over his shoulder in the act of striking, and had accidentally hit the plaintiff in the eye, inflicting upon him a severe injury."
1046,"The case was stronger for the plaintiff than if the defendant had been acting in self defence; but the court held that, although the defendant was bound by no duty to separate the dogs, yet, if he was doing a lawful act, he was not liable unless he was wanting in the care which men of ordinary prudence would use under the circumstances, and that the burden was on the plaintiff to prove the want of such care."
1047,"In such a matter no authority is more deserving of respect than that of Chief Justice Shaw, for the strength of that great judge lay in an accurate appreciation of the requirements of the community whose officer he was."
1048,"Some, indeed many, English judges could be named who have surpassed him in accurate technical knowledge, but few have lived who were his equals in their understanding of the grounds of public policy to which all laws must ultimately be referred."
1049,"It was this which made him, in the language of the late Judge Curtis, the greatest magistrate which this country has produced."
1050,"Brown v. Kendall has been followed in Connecticut, / in a case where a man fired a pistol, in lawful self defence as he alleged, and hit a bystander."
1051,"The court was strongly of opinion that the defendant was not answerable on the general principles of trespass, unless there was a failure to use such care as was practicable under the circumstances."
1052,The foundation of liability in trespass as well as case was said to be negligence.
1053,The Supreme Court of the United States has given the sanction of its approval to the same doctrine.
1054,"/ The language of Harvey v. Dunlop / has been quoted, and there is a case in Vermont which tends in the same direction."
1055,"/ Supposing it now to be conceded that the general notion upon which liability to an action is founded is fault or blameworthiness in some sense, the question arises, whether it is so in the sense of personal moral shortcoming, as would practically result from Austin's teaching."
1056,"The language of Rede, J., which has been quoted from the Year Book, gives a sufficient answer."
1057,In trespass the intent cannot be construed.
1058,"Suppose that a defendant were allowed to testify that, before acting, he considered carefully what would be the conduct of a prudent man under the circumstances, and, having formed the best judgment he could, acted accordingly."
1059,"If the story was believed, it would be conclusive against the defendant's negligence judged by a moral standard which would take his personal characteristics into account."
1060,"But supposing any such evidence to have got before the jury, it is very clear that the court would say, Gentlemen, the question is not whether the defendant thought his conduct was that of a prudent man, but whether you think it was."
1061,/ Some middle point must be found between the horns of this dilemma.
1062,The standards of the law are standards of general application.
1063,"The law takes no account of the infinite varieties of temperament, intellect, and education which make the internal character of a given act so different in different men."
1064,"It does not attempt to see men as God sees them, for more than one sufficient reason."
1065,"In the first place, the impossibility of nicely measuring a man's powers and limitations is far clearer than that of ascertaining his knowledge of law, which has been thought to account for what is called the presumption that every man knows the law."
1066,"But a more satisfactory explanation is, that, when men live in society, a certain average of conduct, a sacrifice of individual peculiarities going beyond a certain point, is necessary to the general welfare."
1067,"If, for instance, a man is born hasty and awkward, is always having accidents and hurting himself or his neighbors, no doubt his congenital defects will be allowed for in the courts of Heaven, but his slips are no less troublesome to his neighbors than if they sprang from guilty neglect."
1068,"His neighbors accordingly require him, at his proper peril, to come up to their standard, and the courts which they establish decline to take his personal equation into account."
1069,"The rule that the law does, in general, determine liability by blameworthiness, is subject to the limitation that minute differences of character are not allowed for."
1070,"The law considers, in other words, what would be blameworthy in the average man, the man of ordinary intelligence and prudence, and determines liability by that."
1071,"If we fall below the level in those gifts, it is our misfortune; so much as that we must have at our peril, for the reasons just given."
1072,"But he who is intelligent and prudent does not act at his peril, in theory of law."
1073,"On the contrary, it is only when he fails to exercise the foresight of which he is capable, or exercises it with evil intent, that he is answerable for the consequences."
1074,"There are exceptions to the principle that every man is presumed to possess ordinary capacity to avoid harm to his neighbors, which illustrate the rule, and also the moral basis of liability in general."
1075,"When a man has a distinct defect of such a nature that all can recognize it as making certain precautions impossible, he will not be held answerable for not taking them."
1076,"A blind man is not required to see at his peril; and although he is, no doubt, bound to consider his infirmity in regulating his actions, yet if he properly finds himself in a certain situation, the neglect of precautions requiring eyesight would not prevent his recovering for an injury to himself, and, it may be presumed, would not make him liable for injuring another."
1077,"So it is held that, in cases where he is the plaintiff, an infant of very tender years is only bound to take the precautions of which an infant is capable; the same principle may be cautiously applied where he is defendant."
1078,"/ Insanity is a more difficult matter to deal with, and no general rule can be laid down about it."
1079,"There is no doubt that in many cases a man may be insane, and yet perfectly capable of taking the precautions, and of being influenced by the motives, which the circumstances demand."
1080,"But if insanity of a pronounced type exists, manifestly incapacitating the sufferer from complying with the rule which he has broken, good sense would require it to be admitted as an excuse."
1081,"Taking the qualification last established in connection with the general proposition previously laid down, it will now be assumed that, on the one hand, the law presumes or requires a man to possess ordinary capacity to avoid harming his neighbors, unless a clear and manifest incapacity be shown; but that, on the other, it does not in general hold him liable for unintentional injury, unless, possessing such capacity, he might and ought to have foreseen the danger, or, in other words, unless a man of ordinary intelligence and forethought would have been to blame for acting as he did."
1082,"The next question is, whether this vague test is all that the law has to say upon the matter, and the same question in another form, by whom this test is to be applied."
1083,"Notwithstanding the fact that the grounds of legal liability are moral to the extent above explained, it must be borne in mind that law only works within the sphere of the senses."
1084,"If the external phenomena, the manifest acts and omissions, are such as it requires, it is wholly indifferent to the internal phenomena of conscience."
1085,"A man may have as bad a heart as he chooses, if his conduct is within the rules."
1086,"In other words, the standards of the law are external standards, and, however much it may take moral considerations into account, it does so only for the purpose of drawing a line between such bodily motions and rests as it permits, and such as it does not."
1087,"What the law really forbids, and the only thing it forbids, is the act on the wrong side of the line, be that act blameworthy or otherwise."
1088,"Again, any legal standard must, in theory, be one which would apply to all men, not specially excepted, under the same circumstances."
1089,"It is not intended that the public force should fall upon an individual accidentally, or at the whim of any body of men."
1090,"The standard, that is, must be fixed."
1091,"In practice, no doubt, one man may have to pay and another may escape, according to the different feelings of different juries."
1092,But this merely shows that the law does not perfectly accomplish its ends.
