,Sentences
3132,"But the points which are material for the present discussion are, that these two remedies are mutually exclusive, / one supposing the contract to be relied on, the other that it is set aside, but that A's stopping work and doing no more after B's breach is equally consistent with either choice, and has in fact nothing to do with the matter."
3133,One word should be added to avoid misapprehension.
3134,"When it is said that A has done all that he promised to do in the case which has happened, it is not meant that he is necessarily entitled to the same compensation as if he had done the larger amount of work."
3135,"B's promise in the case supposed was to pay so much a quarter for services; and although the consideration of the promise was the promise by A to perform them, the scope of it was limited to the case of their being performed in fact."
3136,"Hence A could not simply wait till the end of his term, and then recover the full amount which he would have had if the employment had continued."
3137,Nor is he any more entitled to do so from the fact that it was B's fault that the services were not rendered.
3138,B's answer to any such claim is perfect.
3139,"He is only liable upon a promise, and he in his turn only promised to pay in a case which has not happened."
3140,"He did promise to employ, however, and for not doing that he is liable in damages."
3141,One or two more illustrations will be useful.
3142,"A promises to deliver, and B promises to accept and pay for, certain goods at a certain time and place."
3143,"When the time comes, neither party is on hand."
3144,"Neither would be liable to an action, and, according to what has been said, each has done all that he promised to do in the event which has happened, to wit, nothing."
3145,"It might be objected that, if A has done all that he is bound to do, he ought to be able to sue B, since performance or readiness to perform was all that was necessary to give him that right, and conversely the same might be said of B."
3146,"On the other hand, considering either B or A as defendant, the same facts would be a complete defence."
3147,The puzzle is largely one of words.
3148,"A and B have, it is true, each performed all that they promised to do at the present stage, because they each only promised to act in the event of the other being ready and willing to act at the same time."
3149,"But the readiness and willingness, although not necessary to the performance of either promise, and therefore not a duty, was necessary in order to present a case to which the promise of action on the other side would apply."
3150,"Hence, although A and B have each performed their own promise, they have not performed the condition to their right of demanding more from the other side."
3151,The performance of that condition is purely optional until one side has brought it within the scope of the other's undertaking by performing it himself.
3152,"But it is performance in the latter sense, that is, the satisfying of all conditions, as well as the keeping of his own promises, which is necessary to give A or B a right of action."
3153,Conditions may be created by the very words of a contract.
3154,"Of such cases there is nothing to be said, for parties may agree to what they choose."
3155,"But they may also be held to arise by construction, where no provision is made in terms for rescinding or avoiding the contract in any case."
3156,The nature of the conditions which the law thus reads in needs explanation.
3157,"It may be said, in a general way, that they are directed to the existence of the manifest grounds for making the bargain on the side of the rescinding party, or the accomplishment of its manifest objects."
3158,"Generally speaking, the disappointment must be caused by the wrong doing of the person on the other side; and the most obvious cases of such wrong doing are fraud and misrepresentation, or failure to perform his own part of the contract."
3159,Fraud and misrepresentation thus need to be considered once more in this connection.
3160,"In dealing with it the first question which arises is whether the representation is, or is not, part of the contract."
3161,"If the contract is in writing and the representation is set out on the face of the paper, it may be material or immaterial, but the effect of its untruth will be determined on much the same principles as govern the failure to perform a promise on the same side."
3162,"If the contract is made by word of mouth, there may be a large latitude in connecting words of representation with later words of promise; but when they are determined to be a part of the contract , the same principles apply as if the whole were in writing."
3163,"The question now before us is the effect of a misrepresentation which leads to, but is not a part of, the contract."
3164,"Suppose that the contract is in writing, but does not contain it, does such a previous misrepresentation authorize rescission in any case"
3165,"and if so, does it in any case except where it goes to the height of fraud"
3166,"The promisor might say, It does not matter to me whether you knew that your representation was false or not; the only thing I am concerned with is its truth."
3167,"If it is untrue, I suffer equally whether you knew it to be so or not."
3168,"But it has been shown, in an earlier Lecture, that the law does not go on the principle that a man is answerable for all the consequences of all his acts."
3169,An act is indifferent in itself.
3170,It receives its character from the concomitant facts known to the actor at the time.
3171,"If a man states a thing reasonably believing that he is speaking from knowledge, it is contrary to the analogies of the law to throw the peril of the truth upon him unless he agrees to assume that peril, and he did not do so in the case supposed, as the representation was not made part of the contract."
3172,It is very different when there is fraud.
3173,Fraud may as well lead to the making of a contract by a statement outside the contract as by one contained in it.
3174,But the law would hold the contract not less conditional on good faith in one case than in the other.
3175,"To illustrate, we may take a somewhat extreme case."
3176,"A says to B, I have not opened these barrels myself, but they contain No."
3177,"mackerel: I paid so much for them to so and so, naming a well known dealer."
3178,"Afterwards A writes B, I will sell the barrels which you saw, and their contents, for so much; and B accepts."
3179,The barrels turn out to contain salt.
3180,"I suppose the contract would be binding if the statements touching the contents were honest, and voidable if they were fraudulent."
3181,"Fraudulent representations outside a contract can never, it would seem, go to anything except the motives for making it."
3182,"If outside the contract, they cannot often affect its interpretation."
3183,"A promise in certain words has a definite meaning, which the promisor is presumed to understand."
3184,"If A says to B, I promise you to buy this barrel and its contents, his words designate a person and thing identified by the senses, and they signify nothing more."
3185,"There is no repugnancy, and if that person is ready to deliver that thing, the purchaser cannot say that any term in the contract itself is not complied with."
3186,"He may have been fraudulently induced to believe that B was another B, and that the barrel contained mackerel; but however much his belief on those points may have affected his willingness to make the promise, it would be somewhat extravagant to give his words a different meaning on that account."
3187,"You means the person before the speaker, whatever his name, and contents applies to salt, as well as to mackerel."
3188,It is no doubt only by reason of a condition construed into the contract that fraud is a ground of rescission.
3189,"Parties could agree, if they chose, that a contract should be binding without regard to truth or falsehood outside of it on either part."
3190,"But, as has been said before in these Lectures, although the law starts from the distinctions and uses the language of morality, it necessarily ends in external standards not dependent on the actual consciousness of the individual."
3191,So it has happened with fraud.
3192,"If a man makes a representation, knowing facts which by the average standard of the community are sufficient to give him warning that it is probably untrue, and it is untrue, he is guilty of fraud in theory of law whether he believes his statement or not."
3193,"The courts of Massachusetts, at least, go much further."
3194,"They seem to hold that any material statement made by a man as of his own knowledge, or in such a way as fairly to be understood as made of his own knowledge, is fraudulent if untrue, irrespective of the reasons he may have had for believing it and for believing that he knew it."
3195,"/ It is clear, therefore, that a representation may be morally innocent, and yet fraudulent in theory of law."
3196,"Indeed, the Massachusetts rule seems to stop little short of the principle laid down by the English courts of equity, which has been criticised in an earlier Lecture, / since most positive affirmations of facts would at least warrant a jury in finding that they were reasonably understood to be made as of the party's own knowledge, and might therefore warrant a rescission if they turned out to be untrue."
3197,"The moral phraseology has ceased to be apposite, and an external standard of responsibility has been reached."
3198,"But the starting point is nevertheless fraud, and except on the ground of fraud, as defined by law, I do not think that misrepresentations before the contract affect its validity, although they lead directly to its making."
3199,But neither the contract nor the implied condition calls for the existence of the facts as to which the false representations were made.
3200,They call only for the absence of certain false representations.
3201,"The condition is not that the promisee shall be a certain other B, or that the contents of the barrel shall be mackerel, but that the promisee has not lied to him about material facts."
3202,"Then the question arises, How do you determine what facts are material"
3203,"As the facts are not required by the contract, the only way in which they can be material is that a belief in their being true is likely to have led to the making of the contract."
3204,"It is not then true, as it is sometimes said, that the law does not concern itself with the motives for making contracts."
3205,"On the contrary, the whole scope of fraud outside the contract is the creation of false motives and the removal of true ones."
3206,And this consideration will afford a reasonable test of the cases in which fraud will warrant rescission.
3207,It is said that a fraudulent representation must be material to have that effect.
3208,But how are we to decide whether it is material or not
3209,"If the above argument is correct, it must be by an appeal to ordinary experience to decide whether a belief that the fact was as represented would naturally have led to, or a contrary belief would naturally have prevented, the making of the contract."
3210,"If the belief would not naturally have had such an effect, either in general or under the known circumstances of the particular case, the fraud is immaterial."
3211,"If a man is induced to contract with another by a fraudulent representation of the latter that he is a great grandson of Thomas Jefferson, I do not suppose that the contract would be voidable unless the contractee knew that, for special reasons, his lie would tend to bring the contract about."
3212,The conditions or grounds for avoiding a contract which have been dealt with thus far are conditions concerning the conduct of the parties outside of the itself.
3213,"Still confining myself to conditions arising by construction of law, that is to say, not directly and in terms attached to a promise by the literal meaning of the words in which it is expressed, I now come to those which concern facts to which the contract does in some way refer."
3214,Such conditions may be found in contracts where the promise is only on one side.
3215,"It has been said that where the contract is unilateral, and its language therefore is all that of the promisor, clauses in his favor will be construed as conditions more readily than the same words in a bilateral contract; indeed, that they must be so construed, because, if they do not create a condition, they do him no good, since ex hypothesi they are not promises by the other party."
3216,/ How far this ingenious suggestion has had a practical effect on doctrine may perhaps be doubted.
3217,"But it will be enough for the purposes of this general survey to deal with bilateral contracts, where there are undertakings on both sides, and where the condition implied in favor of one party is that the other shall make good what he on his part has undertaken."
3218,The undertakings of a contract may be for the existence of a fact in the present or in the future.
3219,"They can be promises only in the latter case; but in the former, they be equally essential terms in the bargain."
3220,"Here again we come on the law of representations, but in a new phase."
3221,"Being a part of the contract, it is always possible that their truth should make a condition of the contract wholly irrespective of any question of fraud."
3222,And it often is so in fact.
3223,"It is not, however, every representation embodied in the words used on one side which will make a condition in favor of the other party."
3224,"Suppose A agrees to sell, and B agrees to buy, A's seven year old sorrel horse Eclipse, now in the possession of B on trial, and in fact the horse is chestnut colored, not sorrel."
3225,I do not suppose that B could refuse to pay for the horse on that ground.
3226,"If the law were so foolish as to aim at merely formal consistency, it might indeed be said that there was as absolute a repugnancy between the different terms of this contract as in the ease of an agreement to sell certain barrels of mackerel, where the barrels turned out to contain salt."
3227,"If this view were adopted, there would not be a contract subject to a condition, there would be no contract at all."
3228,"But in truth there is a contract, and there is not even a condition."
3229,"As has been said already, it is not every repugnancy that makes a contract void, and it is not every failure in the terms of the counter undertaking that makes it voidable."
3230,"Here it plainly appears that the buyer knows exactly what he is going to get, and therefore that the mistake of color has no bearing on the bargain."
3231,"/ If, on the other hand, a contract contained a representation which was fraudulent, and which misled the party to whom it was made, the contract would be voidable on the same principles as if the representation had been made beforehand."
3232,"But words of description in a contract are very frequently held to amount to what is sometimes called a warranty, irrespective of fraud."
3233,"Whether they do so or not is a question to be determined by the court on grounds of common sense, looking to the meaning of the words, the importance in the transaction of the facts which the words convey, and so forth."
3234,"But when words of description are determined to be a warranty, the meaning of the decision is not merely that the party using them binds himself to answer for their truth, but that their truth is a condition of the contract."
3235,"For instance, in a leading case / the agreement was that the plaintiff's ship, then in the port of Amsterdam, should, with all possible despatch, proceed direct to Newport, England, and there load a cargo of coals for Hong Kong."
3236,"At the date of the charter party the vessel was not in Amsterdam, but she arrived there four days later."
3237,The plaintiff had notice that the defendant considered time important.
3238,"It was held that the presence of the vessel in the port of Amsterdam at the date of the contract was a condition, the breach of which entitled the defendant to refuse to load, and to rescind the contract."
3239,"If the view were adopted that a condition must be a future event, and that a promise purporting to be conditional on a past or present event is either absolute or no promise at all, it would follow that in this case the defendant had never made a promise."
3240,/ He had only promised if circumstances existed which did not exist.
3241,"I have already stated my objections to this way of looking at such cases, / and will only add that the courts, so far as I am aware, do not sanction it, and certainly did not in this instance."
3242,"There is another ground for holding the charter party void and no contract, instead of regarding it as only voidable, which is equally against authority, which nevertheless I have never been able to answer wholly to my satisfaction."
3243,"In the case put, the representation of the lessor of the vessel concerned the vessel itself, and therefore entered into the description of the thing the lessee agreed to take."
3244,I do not quite see why there is not as fatal a repugnancy between the different terms of this contract as was found in that for the sale of the barrels of salt described as containing mackerel.
3245,"Why is the repugnancy between the two terms, first, that the thing sold is the contents of these barrels, and, second, that it is mackerel fatal to the existence of a contract"
3246,"It is because each of those terms goes to the very root and essence of the contract, / because to compel the buyer to take something answering to one, but not to the other requirement, would be holding him to do a substantially different thing from what he promised, and because a promise to take one and the same thing answering to both requirements is therefore contradictory in a substantial matter."
3247,"It has been seen that the law does not go on any merely logical ground, and does not hold that every slight repugnancy will make a contract even voidable."
3248,"But, on the other hand, when the repugnancy is between terms which are both essential, it is fatal to the very existence of the contract."
3249,How then do we decide whether a given term is essential
3250,Surely the best way of finding out is by seeing how the parties have dealt with it.
3251,"For want of any expression on their part we may refer to the speech and dealings of every day, / and say that, if its absence would make the subject matter a different thing, its presence is essential to the existence of the agreement."
3252,"But the parties may agree that anything, however trifling, shall be essential, as well as that anything, however important, shall not be; and if that essential is part of the contract description of a specific thing which is also identified by reference to the senses, how can there be a contract in its absence any more than if the thing is in popular speech different in kind from its description"
3253,"The qualities that make sameness or difference of kind for the purposes of a contract are not determined by Agassiz or Darwin, or by the public at large, but by the will of the parties, which decides that for their purposes the characteristics insisted on are such and such."
3254,"/Now, if this be true, what evidence can there be that a certain requirement is essential, that without it the subject matter will be different in kind from the description, better than that one party has required and the other given a warranty of its presence"
3255,"Yet the contract description of the specific vessel as now in the port of Amsterdam, although held to be an implied warranty, does not seem to have been regarded as making the contract repugnant and void, but only as giving the defendant the option of avoiding it."
3256,"/ Even an express warranty of quality in sales does not have this effect, and in England, indeed, it does not allow the purchaser to rescind in case of breach."
3257,On this last point the law of Massachusetts is different.
3258,"The explanation has been offered of the English doctrine with regard to sales, that, when the title has passed, the purchaser has already had some benefit from the contract, and therefore cannot wholly replace the seller in statu quo, as must be done when a contract is rescinded."
3259,"/ This reasoning seems doubtful, even to show that the contract is not voidable, but has no bearing on the argument that it is void."
3260,"For if the contract is void, the title does not pass."
3261,"It might be said that there is no repugnancy in the charterer's promise, because he only promises to load a certain ship, and that the words now in the port of Amsterdam are merely matter of history when the time for loading comes, and no part of the description of the vessel which he promised to load."
3262,"But the moment those words are decided to be essential they become part of the description, and the promise is to load a certain vessel which is named the Martaban, and which was in the port of Amsterdam at the date of the contract."
3263,Probably the true solution is to be found in practical considerations.
3264,"At any rate, the fact is that the law has established three degrees in the effect of repugnancy."
3265,"If one of the repugnant terms is wholly insignificant, it is simply disregarded, or at most will only found a claim for damages."
3266,"The law would be loath to hold a contract void for repugnancy in present terms, when if the same terms were only promised a failure of one of them would not warrant a refusal to perform on the other side."
3267,"If, on the other hand, both are of the extremest importance, so that to enforce the rest of the promise or bargain without one of them would not merely deprive one party of a stipulated incident, but would force a substantially different bargain on him, the promise will be void."
3268,There is an intermediate class of cases where it is left to the disappointed party to decide.
3269,"But as the lines between the three are of this vague kind, it is not surprising that they have been differently drawn in different jurisdictions."
3270,The examples which have been given of undertakings for a present state of facts have been confined to those touching the present condition of the subject matter of the contract.
3271,Of course there is no such limit to the scope of their employment.
3272,"A contract may warrant the existence of other facts as well, and examples of this kind probably might be found or imagined where it would be clear that the only effect of the warranty was to attach a condition to the contract, in favor of the other side, and where the question would be avoided whether there was not something more than a condition, a repugnancy which prevented the formation of any contract at all."
3273,But the preceding illustrations are enough for the present purpose.
3274,"We may now pass from undertakings that certain facts are true at the time of making the contract, to undertakings that certain facts shall be true at some later time, that is, to promises properly so called."
3275,The question is when performance of the promise on one side is a condition to the obligation of the contract on the other.
3276,"In practice, this question is apt to be treated as identical with another, which, as has been shown earlier, is a distinct point; namely, when performance on one side is a condition of the right to call for performance on the other."
3277,"It is of course conceivable that a promise should be limited to the case of performance of the things promised on the other side, and yet that a failure of the latter should not warrant a rescission of the contract."
3278,"Wherever one party has already received a substantial benefit under a contract of a kind which cannot be restored, it is too late to rescind, however important a breach may be committed later by the other side."
3279,Yet he may be excused from going farther.
3280,"Suppose a contract is made for a month's labor, ten dollars to be paid down, not to be recovered except in case of rescission for the laborer's fault, and thirty dollars at the end of the month."
3281,"If the laborer should wrongfully stop work at the end of a fortnight, I do not suppose that the contract could be rescinded, and that the ten dollars could be recovered as money had and received; / but, on the other hand, the employer would not be bound to pay the thirty dollars, and of course he could sue for damages on the contract."
3282,"/ But, for the most part, a breach of promise which discharges the promisee from further performance on his side will also warrant rescission, so that no great harm is done by the popular confusion of the two questions."
3283,"Where the promise to perform on one side is limited to the case of performance on the other, the contract is generally conditioned on it also."
3284,"In what follows, I shall take up the cases which I wish to notice without stopping to consider whether the contract was in a strict sense conditioned on performance of the promise on one side, or whether the true construction was merely that the promise on the other side was limited to that event."
3285,"Now, how do we settle whether such a condition exists"
3286,"It is easy to err by seeking too eagerly for simplicity, and by striving too hard to reduce all cases to artificial presumptions, which are less obvious than the decisions which they are supposed to explain."
3287,"The foundation of the whole matter is, after all, good sense, as the courts have often said."
3288,"The law means to carry out the intention of the parties, and, so far as they have not provided for the event which has happened, it has to say what they naturally would have intended if their minds had been turned to the point."
