"Meanwhile Dalia's dad Gene becomes a big man in town on his own, or so he thinks, by getting elected to the congress as a champion of the clean air and green trees crowd instead of letting the smog and concrete boys take over the neighborhood with his eye now on he White House itself!"
"Later on we discover that the young boy who had been raped is a witch doctor and, in an excellent scene with supernatural overtones, he uses his knowledge to kill one of Suleiman's henchmen."
"In a similar fashion, the character Sammo Hung himself plays is a country boy come to the big city of Hong Kong, utterly convinced that what makes the city interesting is that Bruce Lee made kung fu movies there."
This film features a young boy who boards a train called the Galaxy Express in the hopes that he can make it to a planet that has the technology to turn him into a robot.
"The old man had bought the kid at a slave auction and soon discovers the kid is not a boy, which he obviously thought was the case."
"When she arrives at the location, a cowboy tells her she can give one last good - bye to her child."
"Steve Buscemi in Tuileries confronts superstition in a subway with his bag of tourist collections, in Bastille Sergio Castellitto (in love with mistress Leonor Watling) is ready to divorce his wife Miranda Richardson until she confides she has terminal leukemia, Juliette Binouche confronts agony about her son's fantasies and loss in Place des Victoires with the help of a mythical cowboy Willem Defoe, Sara Martins and Nick Nolte and Ludivine Sagnier display a keen tale of mistaken ideas in Parc Monceau, Fanny Ardant and Bob Hoskins' play out' a strange relationship in Pigalle, Melchior Beslon plays a young blind man to actress Natalie Portman in learning how to see in Faubourg Saint - Denis, vampire love between Elijah Wood and Olga Kurylenko in Quartier de la Madeleine, Maggie Gyllenhaal is an ex - patriot actress stung out on drugs in Quartier des Enfants Rouges, and Margo Martindale is a visiting tourist letter carrier trying desperately to speak the French she has studied for her life's trip in a tenderly hilarious 14eme Arrondissement."
If the d - bag boyfriend is a bad guy because he is long - distance boyfriend then why is a soldier any better.
"The boy then asks, puzzled again, why wouldn't he?"
"This leads to Suzanne not only leaving her boyfriend artist Simon, Paul Sand, but later Simon being so depressed and feeling all alone takes a gun to his mouth and blows his brains out."
"He sings expressively and, of course, dances electrifyingly--and the sailor suit makes him look a little more boyish and athletic than usual."
"When taken to a mental ward by mistake in 1990 he meets Jeffrey Goines (spastically played by Brad Pitt, Oscar - nominated here) who frantically spews forth talk about doom and destruction, and later Cole believes he has seen Goines in his recurring dream as a man pushing a boy aside while escaping...what?"
"MY BROTHER TOM Aspect ratio : 1.85:1 Sound format: Dolby Digital Following an episode of sexual abuse at the hands of a trusted neighbor, young Jessica (Jenna Harrison) forms a relationship with a strange boy (Ben Whishaw) she meets in the woods."
My sister and her boyfriend went to rent Zodiac (2007) and got this one by accident.
"you watch this boy and you realize as long as you have been blessed with food, a roof over your head and your loved ones around you .you are truly blessed.and the saying stop and smell the roses truly has a new meaning.and i know jonny will see this and i want to thank him so much for sharing such faith, strenght, and humor with me .thank you jonny i know you soar the heavens and bring much love and laughter to the heavens above"
"His' young boy off the farm' is a great study, made especially poignant because of his bassett - hound eyes."
"There's also no cue the dramatic music moment where Billy (' Worm Boy') realizes what a complete tool he's being to his younger brother Woody, and yet, by the end of the movie, some type of minor transformation has been made."
"He decides to return to his hometown in the north of Sweden, from where his mother left when he was a seven year - old sensitive boy bullied by Conny and other school mates, to live a low - paced life."
"The costumes are really bad - the same zombies reappear throughout the course of the film, wearing the same' Asian - like' clothing that may be found in a Bruce Lee film, and watch out for the blue 60's skirt the girl at the motel is wearing when she and her boyfriend bump into the infected man."
The plot: a nerdy young boy is teased and pranked by a couple of his classmates at the beginning of the film.
"Sinatra is adorable with those blue eyes and curls of his, and plays the innocent boy - man wonderfully (a role he reprises in ON THE TOWN)."
"In the novel, he was utterly ruthless, sending some of his own boys to the gallows in order to protect himself (though he was also caught and hanged)."
"From the episode where a teenage boy accidentally says I will love you forever to the wrong girl, and is stuck with her (literally, at least for a moment, they grow together ...), to the one where a young stewardess goes home with a strange man, only to find herself in his cabin, where he has a trophy room full of other stewardesses, and one I only vaguely remember which compared blind dates to hockey (and the injuries and penalties that go with it) - dating was definitely the scariest thing in the series."
"Fleming flips her hair and scowls a lot, but is totally unconvincing as a fiery tomboy."
Our story takes place in jolly old England where a boy named Oliver manages to work his way out of the orphanage.
"Keen to have some of his own desires fulfilled, Karva has the boy kidnapped."
"And when we get to see them, it becomes obvious Eric and his redhead tomboy girlfriend, next - door neighbor and childhood friend Donna Pinciotti are the sanest people around."
"Garbed in cowboy duds and proclaiming himself as' one hell of a stud ,' the young Texan flounders through his early tricks before partnering with Enrico' Ratso' Rizzo (Dustin Hoffman), a sickly con man and petty thief from the Bronx."
"Floriane takes Marie to a garage where a boy is waiting for her, and then goes away with him for an hour, while Marie is waiting for her to return."
How does the boy fly a helicopter and speak to Anna as he is supposed to be dead?
A small boy keeps a multi - million dollar robot in his closet which breaks when given too many commands by the hordes of cliched dorm - mates.
I personally like the touching story of the boy and his father that dream with a house of their own and built by them; the story of the retarded boy that believes he pilots a train; the story of the man that raises five children as if they were their own sons and daughters; and the story of the young woman abused by her stepfather.
"If you are a fan of Scooby - Doo you can still appreciate the bond between a boy and his talking dog, along with the jokes that come with it."
"While she's there, her father (who looks eerily like George Lucas) and family back home are subjected to a boycott, which turns very nasty."
"In the book, the kid almost becomes Noon's shrink and vice versa and the reader understands why he goes in search of this boy, once he finds out the kid disappears and thinks he might be a hoax."
"The boy repeats it quietly after he expires, giving viewers the impression that the name is of some significance later on in the film."
"All I could tell was that he wasn't particularly happy with his physical appearance, and that he had a crush on an older boy."
"Still, she's considerate of the colonel enough to have said toy - boy her own age (what a gal! )"
"Cassie becomes very emotionally upset and has nightmares which cause her to have hallucinations about her boyfriend coming back to life and encounters men trying to murder her and she is struggling to find out who her real friends are, who wants her dead and will she survive this entire horror ordeal."
"He is put in a cell with three others; the quietly insane Lassalle, body building transvestite Marcus and his retarded boyfriend Daisy."
Sabu captures all the innocence and mischievousness of youth as he fulfills the Arabian Nights fantasy of the boy who topples a tyrant.
Dick Powell & Ruby Keeler once again play lovers onstage & off; the fact that her singing & acting abilities are a bit on the lean side are compensated for by her dancing; Powell still exudes boyish enthusiasm in his unaccustomed position as second male lead.
"She does that by choosing some kind of sport, and with the help of a local boy, that for some reason falls in love with her, she confronts her problems and wins."
"Sheeta, the female lead in this movie is totally awesome and the boy, Pazu is also a great role - model--he lives on his own!"
Russell Sams has a small role as Strickland's new boyfriend and he would have been better probably given a bigger role.
"When the world's media finally caught up with her she gave no hint of her darker past and she was soon giving interviews for magazines, T.V and being photographed at Playboy parties with the likes of Pamela Anderson and the equally tragic Anna Nicole Smith."
"Like all her films ,' Bonjour tristesse' suffers not at all from her looks (though she is perhaps the first of those modern women whom Tom Wolfe gleefully, accurately describes as boys with breasts: publicists, of course, use the word gamine) but suffers grievously from Seberg's dull, monotonous, killing voice."
"An old woman in bad makeup and a black cloak keeps appearing to the boy and chants something in German sometimes, which he eventually records on his Sesame Street tape recorder."
There is a big showdown between Wai and Pang with the terribly abused woman the major victim and leaving Wai dead and Pang cutting out his child from the dead mother only to die and leave him as the possible next boy to be raised as a killer.
The script bucks more than one horror cliche off its back (several it can't shake) including Chris Sarandon as the heroine's boyfriend who actually listens to her as she insists that eerie things are going down.
"An English - Indian girl and her parents, with their traditions and strong family ties, and on the other hand the English family with a daugther who dresses like a boy, and plays soccer...a combination which worries her mother!"
The fact that they allowed the young Marcel to travel along with Leo to Paris to meet his ex boyfriend was quite a gesture from them most families I know will be reluctant to do that.
The story - which almost everyone is surely familiar with by now - revolves around a little orphan boy named Oliver and his life growing up in London.
"In Boy Meets Girl, when someone gets their heart broken we see blood pour from their shirt, when a couple kiss on the sidewalk they spin 360 degrees as if attached to a carousel, when Alex enters a party an feels out of place, its because the most interesting people in the world really are in attendance; like the famous author who can't speak because of a bullet lodged in his brain, or the miss universe of 1950 standing just across from the astronaut."
"Distasteful, cliched thriller has young couple doing cross - country research on America's most infamous murder sites, becoming road partners with a dim - witted young woman and her snarling boyfriend--who is an actual psycho."
I paused at a scene where the little boy meowed so loudly to the man finding his sister upstairs and I was shocked.
I thought the dialogue was very sharp and the premise of story is rather shocking - at one particular point Barbara Stanwyck is openly flirting with her daughter's boyfriend; AND rekindling some passion in her husband whom she hasn't seen in ten years; AND with the gunshot signal' two shots and then one' she hooks up with her old shag mate Dutch (the reason she left town in the first place! )
"Finally, check out Kirk's smug approach at the start of the episode - boy, do things go sideways on him as the story progresses"
"Throughout the rest of the film, there is a love triangle as the woman's boyfriend is back in town visiting her for the season."
She runs to the watchtower and meets the boy (I am just not mentioning his name because I cannot remember it and do not want to go back to the previous html page) and can say good bye to him and forget those terrible dreams forever.
Things change when Christy grows older because he has a young boy's desires and emotions.
"Walsh) mistakes him for a hit - man whom Wayne has hired to do in his sexy young wife Suzanne (Lara Flynn Boyle in fine form), Michael plays along and accepts Waynes' money."
"The main thing people may fail to realize that this story is told through the point of view a little boy and, as with most younger children, he gets frightened easily."
"OK, really finally - when the introductory comments (in a voice - over, no less) casually mention that one of the characters gave up her boyfriend to focus on her fencing you can be darn sure there'll be some fencing by the end of the movie."
"Karen(Bobbie Phillips)mentions, after one of her kids gets out of hand with his lame annoying jokes, that she'll never survive this trip .. boy, is she ever on the money."
"Before the alien eats her boyfriend and assumes his identity, you get to see her in the body of Alex Meneses."
She doesn't recognize her own boyfriend anymore and uncanny fragments of the accident keep flashing before her eyes.
"I don't remember too much about it, but that a Native American boy lives in a nice village with his family, and I don't remember what happens, but he is supposed to go out to the wilderness alone."
"Either way, I don't want to see the little boy grant him the second."
"From watching the film you can see the husband arguing with his wife the balance between work time and family time and you can easily understand it, but the little boy doesn't."
"His growth from a completely innocent boy who knows nothing of his past, to his breakthrough realization in Act II of what Amfortas's eternal wound means and how it has become his own, to his return as the great Redeemer of Act III this is the journey of a masterfully constructed character."
"She is, to put it simply, gorgeous, and Boyer gives a most effective, understated performance, letting his sensitive face do much of his acting for him."
"I was compelled to watch, not by any great acting (although Boyer is marvelous as usual, managing to convey a rich mixture of world - weariness, tragedy, hope, and fervor with his magnificent voice and yearning eyes), but by the down - spiraling rush of one man's slim hopes against a world of oppression and money."
"Anyhow: The lead actor portrays a loser who escapes into a fantasy world of being a cowboy in an Urban sprawl . He comes across a family with two spoiled brat children, a teenage girl and boy; taken care of by a strict single parent father who can barely cope."
"The boy is understandably ridiculed until a bevy of professional athletes, led by former NBA star Alex English, join his cause."
"as son and mother who share a fondness for silverware; Greg Kinnear as Captain Amazing and Ricky Jay as his publicist; Kel Mitchell as Invisible Boy; Paul Reubens as The Spleen; and Lena Olin who, if she didn't have the few lines in this movie that she has, would seem to be visiting the set"
"They bond, Devon comes out, and the mysteries begin: boys are missing in the neighborhood, Devon's stepfather psychologist Dr. Kirk Tyler (Dan Swett) is not at all what he appears to be and despite Devon's consoling mother Donna (Sonja Fisher) Devon is cast into the streets because of his new relationship."
"the story of this movie is about a gay writer named Reve(Krabbe), an alcoholic person who is lives by his own moral values and sees many visions that may warn him from a future accident.after the end of his lecture, he introduce a seductive woman named Christine, who has a mysterious past she doesn't want to reveal . Reve do sex with her at her house as she is a boy.next morning, he watch her sexy, macho boyfriend's picture on her table, the person he met at the station.he is curious to meet him and tell Christine to invite him to her house."
PAGE 3 * * * * out of 4 Stars Madhvi (Konkona Sen) enters her boyfriend's house and its empty.
"Schoolboy Gregory is now a teacher at the same school where at the tender age of sixteen, he harboured a hopeless passion for the football playing Dorothy."
"Complications ensue when George finds himself being blackmailed by the bitter Julia Freeman (a nicely venomous turn by Kathy Williams), who wants George to spring her psychotic biker boyfriend Laurence Mackey (a frightening Robert Tessier, who sports a head full of hair here) from jail."
"For example, there's a telling moment when one of the secondary characters, openly gay, is visited in the hospital by his boyfriend who brings him flowers and tries to kiss him in front of his visiting family, and suddenly we see a wave of awkward discomfort wash through the room."
I actually thought that the key roles of the boy and his Grandfather were really convincing - and at times unusually beautiful.
"The next day Jane's wild boyfriend Cleveland (Saarsgard) kidnaps Jon from work and takes him out to a hulking abandoned steel mill, and soon Jon, Cleveland and Jane are spending every waking moment together going to punk rock concerts, doing drugs and drinking lots of alcohol."
"a boy nearly loses his foot in an elevator, but his leg is cut around the ankle, a guy is toasted by electricity and diesel, and in the weight room, dead people are laying around."
"The movie had some nice scenes that were almost original, like the trails of rubbish, the simple special effects for he ghosts, the eyes of the boy, the cat that made eery noises, the gurgling of the dead boy and his mother."
"Screaming Mad George was responsible for the killer toys( .. including a larvae which enters a victim's mouth and out his eye, another where soldier toys actually shoot real bullets at a babysitter after her boyfriend was practically strangled by a severed hand toy, operating from a remote control)."
"This movie is both charming, and charismatic as a musical sing - along, as well as being a moving drama that follows a young boy as he tries to find where he belongs in life"
"Preston Blake is an annoying, obnoxious, boy, who decides that, when written a blank check by a complete stranger, he will take advantage of the situation as best as he can."
"Later she is being told by the doctor, that a boy also has this strange disease and she realizes that with the boy she has drawn, she also got that boy into her disturbing dreams."
Masterful direction and casting make the journey of rocket boy Homer and his pals seem fresh and new.
"This is seemingly a fine opening for a teleplay about a boy discovering his homosexuality, or perhaps a medical drama about a post - pubescent teen with a severe hormone deficiency."
"Lionel's amused by it until Jean sets her sights on his playboy son, Franchot Tone."
"His first four films (ELEPHANT BOY-1937, THE DRUM-1938, THE THIEF OF BAGDAD-1940, JUNGLE BOOK-1942) were his best and he found himself working out of Hollywood when they were completed."
"Toby Malone is the true star of the film with his endearing portrayal of Matt, said country boy and local Aussie Rules football hero come to the big city to try out for one of the big teams."
"Director Verhoeven does a great job, or should that be the special effects boys make him look good."
"Yes, I understand people swear but it seems like a preteen boy scripted this and thought himself cool for including all the language."
It would be one thing for this boy and his flock to protest an actual war or the USE of nuclear weapons.
"For me, the most splendid scene was in the Highlands when Rob Roy tells his boys what honor really means."
"Brian (Chris Pine of Star Trek) is driving and his girlfriend Bobby (Piper Perabo of Coyote Ugly)has shotgun, while Brian's younger brother, Danny (Lou Taylor Pucci of Fanboys) and his friend--not exactly girlfriend--Kate (Emily VanCamp of The Ring 2) occupy the backseat."
"One is tough and masculine and mocking and provocative (she could pass for a pretty boy, and teasingly hints at that: Are you a girl or a boy?"
"I don't quite remember how, but some type of agreement is reached, and the boy decides to go back to the game he loves in an incredibly sappy and ridiculous scene."
His recent spoof films are lazy messes that look and feel as if they were made by pre - pubescent boys snickering at penis jokes.
About a boy who's father is always working and never around who finds a new friend who makes his life better and eventually helps him reconnect with his father.
Even so Artemisia could paint her boyfriend and her art teacher completely naked.
They brain a delivery boy and then drown him to make sure.
"While climbing through a barbed wire fence, the gun accidentally discharges and the younger boy fatally shoots his older brother."
"When the kids are in detention, given by the coach , 2 of the boys give Marty a joint that will make him throw up."
"Walsh for the man he has commissioned to murder his wife, Mr Cage calls on the wife to warn her of her husband's intentions . In turn she, in the person of Miss L.F.Boyle, offers him even more money to murder Mr Walsh . Mr Cage decides to leave whilst he is still in front but as he is driving out of town he hits a man in the road . Tempted as he might be to drive on, he takes the man to hospital, where it turns out he has been shot . Mr Cage is detained by the Deputies who call the sheriff who turns out to be Mr J.T.Walsh."
"This incredibly overrated anime television series (26 episodes , 25 minutes each) is about a 14-year - old boy (and two of his girl classmates) who pilots a giant robot to defend Japan against invading beings called Angels."
"I am from the country, therefore boys with an accent have no appeal to me, but for him I would definitely make an exception."
"Soon enough, the boyfriend (who doesn't know about the kiss, but is very protective of the woman and thinks the soldier has been trying to move in on her) decides to propose to the woman and she accepts."
"Diane Neal Is good as the woman who steals Dracula's body in order to finds a cure for her dying boyfriend, And Stephen Billington is great as Dracula himself."
"In Le Marais one boy pours his heart out to another boy confessing of sudden unexpected closeness, asking permission to call - never realizing that the object of his interest does not understand French."
Ranma 1/2 is about a boy named Ranma Saotome and his dad Genma Saotome.
"( The tale was written by that old boy Godfrey of Dads Army fame and it is clever) Arthur Askey is entertaining and is very at home preforming his routines to you and the cast, he also shows he can act a bit!"
"Celebi transports itself and a boy named Sam 40 years into the future, to the present day, where Pokemon trainer Ash, his faithful Pikachu, and his friends Brock and Misty are traveling through Johto."
"Also future - bound is Ben Alexander, who plays the boy Bobby; he becomes a dependable child actor, and grows up to become a Jack Webb partner on Dragnet."
"A charming boy and his mother move to a middle of nowhere town, cats and death soon follow them."
I know it was the streets of Bedford Stuyvesant that changed this chubby little boy into the vulgar monster that he was.
"I haven't read the one that A Message from Charity was based on, but would like to since it was interesting - a 16-year - ld boy, Peter (Robert Duncan McNeill) is suffering a fever from unclean water, that has always been common in his Massachusetts hometown...but he is able to see through the eyes of a young Puritan woman suffering the same type of fever, Charity Payne, (Kerry Noonann) who also finds herself able to experience what goes on around him."
"Arquette is a golden boy, scoring a big sale on his first call- to widow Kate Capshaw and her dopey son Ryan Reynolds."
"The millionaire who funds the project to thaw the Yeti looks like Chris Penn and John Goodman both poured into an ill - fitting suit - the guy playing the scientist is one of the worst actors to ever appear on screen - and yes, there is a mute boy (who sorta kinda looks like a girl) and he's mute ever since he survived a plane crash that killed both his parents (hmmm- maybe therapy for the kid??)."
"One notices mainly the gusto, the awesome pace, the thrills, the nice suspense, Lara Flynn Boyle's cute tight small ass, Cage's enviable physical shape (though undeniably ugly, with sharp, bird features, thick eyebrows and thin, rare hair, Cage displayed a fine overall shape), Hopper's consummate routine, some moderately but truly funny moments, Cage's play with his intended persona, Hopper's rigid, psychopathic allure, Lara's meanness, Cage seems a roamer, the archetypal gloomy roamer of the noir cinema, hungry, tough if needed, naive, dirty, tired."
"In some sick deranged way, he actually thought he and the little boy would become partners - a duo of terror."
"It has more to do with the relationship between her and the boy, and the boy with his conspiracy group in which the producer / director dedicated no time in elbaorating, and yet dedicated a portion of the film dragging the issue."
"Like many of the Bollywood movies I've seen, this one is melodramatic and opera - like, including here notably a song sung first by a little boy to cheer up his abused and unhappy sister, and then the same song sung 12 or so years later by the man who has travelled to Kathmandu seeking to re - connect with this girl, grown up and troubled (she had been told her brother and mother were dead), numbing her pain with drugs."
