"The young girl lives with her grandparents and is trying to let go of her mother the best way she can, and the discovery of a new body seems strangely enough a method in which to accomplish this (again, the underlying current of Jindabyne is surmised)."
"However, Hollywood did beckon him one last time to his old seafaring ways - albeit for a modestly - budgeted Universal picture rather than a Warner Brothers' A' production to which he had been accustomed when at his peak...Still, the glorious Technicolor cinematography leaps off the screen here and, while an older and flabbier Flynn may look like the pale shadow of his former self, his red - headed leading lady Maureen O'Hara has a field day as a tomboyish buccaneer leader who deep down craves romance and wants to be treated like a lady."
"Philippa Boyens said as much in an interview, when she said they deliberately didn't re - read the books before writing the script."
"The big problem is the conflict it causes between the boy and his father, which I think was overdone."
"Pegg has had a few hits in the past few years, starting with Shaun Of The Dead in 2004, movie on to Hot Fuzz 2007, early 2008 he came out with Run Fat Boy Run and now comes this, How To Lose Friends And Alienate People which is in many ways one of my favourite comedy's of the year."
"Also going along with Burgade is Susan's boyfriend Hal Brickman, Chris Mitchum, who proves in the end that he's as good as Burgade is, who felt that he just didn't have it in him, in both tracking down the escaped criminals as well as using common sense, which in this case Burgade lacks, in doing it."
The relationship looks good with his boyfriend / exhooker and he leaves his family to try life with this first guy.
"Once a geek - boy, always a geek - boy; and the sad, simple fact is that he's incapable of playing anything but Fox Mulder."
"A woman frames a cop boyfriend for her own murder, and his buddy, an ex - cop journalist, tries to clear his name by checking up on the dead woman's crazy female friends."
"One girl decides to take a bath, another decides to cheat on her husband (who is also there) with an old boyfriend so they somehow find a bed (in an old abandoned school? )"
"Sailor's on leave, they have to take home a runaway boy (Dean Stockwell) and Sinatra falls for his aunt."
"Well - shot with realistic performances especially a very good one from Depardieu as a cad and bad boy with realistic locations mood and art - house connotations all over, it fails because the director takes no position, stand or critical commentary on the topic he stipulates."
"Boy - girl love affair / sequel with songs, only this time she's the punkette and he's the straight arrow."
"An excellent example of cowboy noir, as it's been called, in which unemployed Michael (Nicolas Cage) loses out on a job because he insists on being honest (he's got a bum leg)."
"The Abbot is a loving guardian, but perhaps a bit too strict and much more concerned with fortifying the wall around the town from a coming attack by vikings than he is at nurturing the boy's imagination."
"Soon after she discovers who he is, tragedy strikes, and revenge sweeps through the air as the boy goes after his torturers (Daniel Baldwin, George Wendt, Vernon Wells) for their previous kindness."
"Clearly the young man is not as open as he seems, and the family not as accepting as he might want them to be, while the boyfriend is confused and rejected."
"She's dead now of course, but he could easily visit the Jesuit priest in East LA who runs Homeboy Industries, which works with young men typically with gang and prison backgrounds to teach them career skills, get their tattoos removed, and to become responsible members of society, or he could visit USC's Institute for Advanced Catholic Studies, which has brought together some of the world's finest theologians, diplomats, and investment bankers to study ways in which to ethically integrate the world's poorest countries into global capital markets and thereby improve the standard of living for the half of the world's people who live on less than $1 a day."
The boys spend a lot of time listening to music and it is made clear they despise the fascism that communism has created as they engage in tiffs with a fascist charlatan who has Stalin tattooed on his hands.
"At the slave market, the young boy is sold to a middle - aged German paedophile, and we are left to guess whether the boy will still be considered wunderbar when his owner is on the receiving end of his witch - doctoring skills."
The boyfriend was too stupid for his own age.
"THEN, he proceeds to give them all pounds and handshakes and joke around with them as if they're his homeboys."
"The first is that I'll never forget the long tan fascinating legs of (Charlotte Lewis) especially when she was on bed before the bad guys attack her house, wearing just a blue shirt and OH BOY the camera was versifying about her naked legs as it should be."
He starts a relationship with the single mother of an extremely annoying little boy; she's the one who had been demanding results from the research.
"( Jada Pinkett Smith) While tending to Charlie's recovery, Alan looks inward and recognizes his own silent screams at the death of the independence he once owned and the boy he has lost becoming a man."
A respected dentist in LA snaps when he finds out his wife is cheating on him with the pool - boy.
"As May comes to realize the world is still important to her, the lonely widow finds her libido reawakened and alive with her daughter's boyfriend, a carpenter and rough sort."
"Dumped by his girlfriend, a hotshot yuppie doesn't want to be left alone on Christmas so he decides to return to his boyhood home, imposing on the dysfunctional family that now lives there and bribes them to pose as his family."
"Matuschek may have lost the love of his family, but he recaptures it in the affection of his employees, and you feel a heartwarming glow when, in the bitter cold of a Christmas Eve snowstorm, he finds companionship in a freckle - faced young errand - boy (Charles Smith)."
But soon she finds out his secret: he kills two people (her ex - boyfriend and his bodyguard) to protect her before her very eyes.
"The hero is a whiney security guard, his girlfriend is always complaining, they have a tramp friend who has a jerk military boyfriend, and another friend who is a spaz."
The man still persuades tho boy that he is their father by the only definition that counts.
In keeping with this thought I feel it is important to point out that one actor has risen and persevered well beyond this campy to tasteless production to have become a respectable and quite talented performer . I am referring to Laura Harris a Canadian born actor who has etched her way through many poorly produced shows and movies to find a place on the HBO hit Dead Like Me where she plays the role of Daisy Adair and to her credit she handles this role in an efficient manner . I remember having a typical boyhood crush on the young actress during this series where she played Ashley a soft spoken yet intelligent 7th grader . I felt as though if anyone might make it from this series it surely would be Laura Harris and true to her nature she did excel in the acting field to win the respect of many producers who now recognize her for her talent as well as unique Nordic blond allure.
The father becomes boyfriend of his own daughter and his ex - wife knows about it and finds it alright.
"According to the book The Last of the Cowboy Heroes which is about Joel McCrea, Audie Murphy, and Randolph Scott, the author says that Albuquerque was the only film he personally did not review because he claimed it was lost."
"This boy is in need of care with a capital C. Behind in school, still wetting the bed, and unable to read are the smallest of his problems."
"Mary is devastated, but she doesn't want to admit to everyone back home that she was a failure, so she continues to see Driscoll and we she has lunch with him in the studio cafeteria along with other extras dressed as policemen, soldiers, cowboys, etc."
"Cramer has the boys cook him up some food - and they make a synthetic meal (boot laces for spaghetti, for instance) to get him sick to be overpowered."
"The plot is conventional for the period but, regrettably, it now seems barely tolerable But there is Gene Kelly, who dominates the movie with his agreeable personality Perhaps he grins too much, but when is permitted to dance, the film finally lifts off the ground I Begged Her, his early song and dance with Sinatra, is amusing and slightly absurd, in which he imagines himself as a bandit chieftain in a Spanish courtyard, courting maiden Grayson with a flamboyant flamenco dance and some athletic leaps He also does a charming Mexican dance with little Sharon McManus in the square of a Mexican settlement in Los Angeles The highlight of the movie, however, is Kelly's famous dance with the cartoon character Jerry the Mouse (of Tom and Jerry fame)."
All I knew about it was that it was the story of an 8-year - old boy at the time of the Cuban Revolution in 1958 and how it affects his home and family.
"Painfully bad Christmas film that has an equally painfully bad performance by Vince Vaughn, who is paying his usual frat boy self but this time for a children's movie but with out the wit or charm that is in his R rated films."
"Rob replies in a noble tone, it's not the fault of the child, and then states what he thinks the name should be, girl or boy."
"I tried to convenience myself that it was a flashback, and therefore supposed to look old, but it looked WWWWWWWAAAAAAAAAAAAYYYYYYYYYYY more 80s than 60s or even 21st century trying to be 60s...then an adult coworker of the lead character turns up, and he looks just like the boy featured in the flashback sequences (yet it's a different, much older character whose youth is featured in the flashbacks)."
"She's in love with her boyfriend and wants to marry him someday, but she's become so fond of the soldier."
The oldest boy is very hard to get along with he is a brat.
"Keith is as breezy as possible playing the eponymous lead, an unabashedly drunk jungle guide shanghai'd into escorting rich boy Van Hoffman and his gorgeous wife Shower on a hunting expedition in cannibal country."
"But she is a very flexible figure, as far as the type of her boyfriends go."
"The boy, named Tristan grows up to be a rather hapless young man (Charlie Cox) who is smitten with a girl way out of his league and also betrothed to another."
"The boy in particular senses right from the beginning that something's wrong: he has been told by the cook, Dick O' Hallorann (Scatman Crothers) that he is endowed with a mysterious psychic energy, the titular Shining, which allows people like him and Dick to see flashes from the past and the future, among other things."
"Caleb though generally a thoughtful, kind, insightful boy can at times show the latent dark side inherited from his father."
"Notwithstanding the last scene of this part was unnecessary from a dramatic - construction point of view (it would have been far more interesting to end it when the mother and boyfriend / stepfather are strutting the girl away), it is frankly a bit disgusting that the scene where we learn for sure that the girl's father is Latino ALSO must inform us that he is a sexually desirable dancer."
"Santa talks about delivering presents to all the boys and girls, yet he seems to only deliver to 5 houses of kids in Mexico."
"The movie is literally a journey up through his own stream of consciousness, against time's current and back to when he was a boy."
"Wild Bill uses a Bowie knife, which he eventually gives to the boy, calling it an Arkansas Toothpick, which in reality was a different type of knife, though both were used throughout the frontier."
"While outside he befriends a young boy whose stepfather (Greg Grunberg) mistreats his mother, won't let her near the darkroom in his basement & acts suspicious in general."
Julia Ross (Nina Foch) agrees to take a position as a secretary with the rich Hughes family to get over her boyfriend leaving her.
"Was it foreshadowing when Tori complained that her first boyfriend was treating her like a robot, and then her new boyfriend (the murderer) turned out to be a designer of artificial intelligence?"
"Murder by numbers does not take place in a single room, like the rope, mind you . And, what a supreme originality, it pits two cops against the evil youngsters;and, you would never guess it, these two cops are very different: actually, Bullock plays the part of woman living like a man, and her partner (Chaplin) is as shy as a clueless girlie . The two boys' performances are not really mind - boggling, not as good, as, say, that of Edward Norton in primal fear."
"Robert Carlyle plays Hitler during his later years, during this documentary that only deals with Hitler from boyhood until he became Chancellor of Germany, including The Night of the Long Knives."
"The water boy bravely blows a bugle (which comes from nowhere) to sound the alarm...this he does by standing up high on a wall so he can be seen and shot by the bad guys, and we shed a tear as he keeps trying to sound more notes as he is repeatedly shot and the bugle call breaks up into feeble squawks...instead of blowing the bugle while hiding behind cover as anybody with half a brain would do."
"We know from early on that he is terrible with women, which links him to the little boy at the beginning of the film, but then in the middle of the film, he appears at a party, smiles flirtatiously at two of the main girls, and then gives them a hateful look and walks away, disappearing from the party and from the movie with no explanation."
"Candy's wallet contains a roll of microfilm invaluable to the Communist movement, and it's her last job for ex - boyfriend Richard Kiley to make the delivery."
"When Kei loses the one friend he has he gives up until he meets Sho, an orphan boy who is not repelled by his true nature."
"To his surprise, Manuel Tur, one of his boyhood friends is also being treated, and the young girl that was not welcomed to participate in their games is now one of the nuns that supervise their health care."
"When October Sky unfolds a story of a young man crying out loud to claim his right over his own destiny ,! SSRocket Boy! "" offers a more compromised description that could sometimes constitute an acrid criticism of modern society."
"If he kills her, there may be an end to the troubles of this misunderstood boy."
"The film opens on the day of a crucial World Cup qualifying match between Iran and Bahrain, a girl is trying to get in to Tehran's Azadi Stadium by dressing like a boy, it looks like she will get in until a soldier tries to search her."
"Coming home to pursue his girl again, he contrives to annoy the Boston Strongboy, mighty John L. Sullivan, who enters bars and claims he can lick any man in the world."
"Brand produces the cash but, because he has no candy, the boy burns his vehicle anyway."
He was the most precious little boy I had ever met.
"Disposing of her boyfriend, not thinking of informing family or using the money he gave her for a proper funeral, she selfishly splashes out on a trip to Spain."
"It's the standard knocked - up girlfriend, her loser boyfriend and his wicked mother ludicrousness that we have seen in countless movies before."
"The young boy is born as an enlightened one, destined to save the world from evil forces, but whose very life is in danger, if not for the help of Murphy, and his beautiful, mysterious and mystical helper / guide / protector."
"He finds George, a junior hockey coach, and donates a kidney to him, and then donates bone marrow to a young boy named Nicholas."
It seems Dr Tyler is in a dark business with hunky Detective Cunningham (Earl McDougle) who apparently is investigating the missing boys...Devon gathers his resources from his understanding girlfriend Jenna and her cronies and together the group unveils the dark doings of Dr. Tyler and his detective sidekick.
Now he kills two cops outside teenager's house and somehow sneaks into her bedroom and kills her boyfriend.
"There he meets the blacksmith (Emile Meyer), his daughter (Karen Sharpe), her boyfriend(John Lupton), the marshal(Henry Hull) and the Saloon owner (Ted De Corsia)."
"This is a bad movie about a savage boy adopted by two parents, but he gets into trouble later."
"The Brits (Holmes Herbert, Miles Mander, and best - if not worst - of the lot, George Coulouris) don't give much hope to Boyer's cause (which he soon grasps may be Britain's before long)."
"I'd have to say that this was a little embarrassing for the' King of the Cowboys'; made in 1948, the picture came out a decade after Roy Rogers' earliest pictures in which he had a starring role."
"by Sydney J Furie, a really good director who made films like The Boys in Company C. Has his ability failed him, or was this hopeless from the get go and he didn't even bother?"
"I mean she IS a model, so that would be redundant), not just by her 24/7 schedule, by also by her insistent ,' wanna - get - married- right - NOW' boyfriend Michael (Chris Sarandon of DOG DAY AFTERNOON and the classic SOB.I.G."
The actor who hosts the cable access show is just amazing he is so serious and deadpan and his performance as both the doctor and the boy in the plastic bubble is enthralling.
"For example, is it necessary for a healthy sixteen year old boy to have a jacuzzi in his bedroom, or have his bed tricked - out with Low Rider hydraulics?"
"I think the Dark - Heart character is a little on the rough side and I don't like the way he shape - shifts into a mean frog, fox, boy I was wrong, This movie was made for my kid, not for me."
Why did the boy's mother testify in her behalf?
"Peter Strauss as Emory, John Goodman as his best friend, Gary Cole as his college - boy brother, Pamela Reed as Emory's sympathetic wife and John Doucette as his dying father all turn in excellent performances in this fine picture"
"She dreams of a troubadour that will woo her, but is constantly interrupted by the only available local boy, Johnny Applebloom."
"Nevertheless, it cannot be denied that Tykwer delivers a lovely segment in which a blind boy picks up the phone, and hears from his girlfriend (Portman - for once not annoying) that she breaks up with him, and he reflects on their relationship."
The premise of the story is a widow and her daughter and they move to the west to be a house keeper of this cowboy.
"On his birthday a small boys tells his mother he is not her son, and that he wants to go home to his real mother."
"This installment spends much of its time following the minor misadventures of the little boy, who begins to stare into the abyss of death his father opened for him"
"To Be Honost With you i think everything was so good in this movie there should be no reason why it didn't go into theaters, The Deaths in the movie are awesome the fx are awesome when used, There are a few dull moments when the story's following the little girl but all in all this was a very good movie that i hope someday get's the props it should . The very first part of the movie is prob why it came straight to video with them killing a little boy but after that the story is based on a little girl and her mother who came to visit the moms boyfriend who moved out to try to become a writer, The property he buy's turns out to be where the Witch(Tooth Fairy)lives and anyone who live in her house or goes on her property will be in great danger don't wanna give anything really away just a little info if you've wanted to see this movie then do so it's worth the price of the renta"
"His eldest son, a thirteen years boy Michael Sullivan Jr., perfectly played by young Tyler Hoechlin, after years of blissful ignorance finds out what is his father job and on what money their family live."
"A typical Goth chick (Rainbow Harvest looking like a cross between Winona Ryder in Beetlejuice and Boy George) gets even with people she feels have wronged her with the help of an old haunted mirror that she finds in the new house she and her mom (horror mainstay, Karen Black, the only remotely good thing about this travesty) buy."
Devon (James Townsend) by all appearances is a successful kid with a kind girlfriend Jenna (Sarah Kelly) but he has an eye for boys and visits a bar where he meets Brian (Alex Wilson) who has been down the same path and can offer Devon assistance on every level.
"You can't deny the initial star - gazing in recognizing the notables, from Irrfan Khan to Natalie Portman (who also had writing and directing duties), Rachel Bilson (looking quite like Bardot) to Spielberg's blue eye boy Shia LaBeouf, who surprisingly can act, and shows off more in his few minutes here than his entire filmography to date."
"Joseph Brady and Clarence Doolittle are two sailors, who have a four - day shore leave in Hollywood . Joe knows everything about girls and can't wait to see Lola, while Clarence is shyer and needs some advice from his buddy on how to meet girls . They then run into a little boy, Donald Martin, who has ran away in order to join the navy . They take him home and meet his beautiful aunt Susan, who wants to be a singer . Clarence wants Susie to be his girl, but his shyness gets in the way . But he doesn't feel shy with a waitress, who comes from Brooklyn, like he does . Soon Joe notices he's in love with Susie . The boys are in a fix when they lie to Susie on meeting with a big time music producer they don't even know . As they are in a fix with their feelings . George Sidney's Anchors Aweigh (1945) is a great musical comedy . Gene Kelly is top - notch, once again, in his singing and dancing routines . Frank Sinatra is terrific as the shy guy from Brooklyn . Shy isn't the first thing that comes to mind when you think of Frank Sinatra, but he plays his part well . Kathryn Grayson is fantastic as Susan Abbott . We sadly lost this gifted actress and operatic soprano singer last month at the age of 88.The 9-year old Dean Stockwell does amazing job as the little fellow wanting to become a sailor . Jose Iturbi does great job performing himself . It's magic what he does with the piano . Edgar Kennedy plays Chief of police station . Sara Berner is the voice of Jerry Mouse . There's a lot of great stuff in this movie and some fantastic singing and dancing numbers . Just look at Kelly and Sinatra performing We Hate to Leave . It's so energetic."
Chris Sarandon was good as her caring but ultimately self - centered boyfriend.
"Sick of people feeling sorry for her, single - woman, Kat Ellis (Debra Messing, TV's Will and Grace) hires male escort Nick (Dermot Mulrony, About Schmidt) to pose as her boyfriend for her sister's wedding in London."
"He is believable in an unsympathetic part as a weak willed Mama's boy, and allows himself to age realistically but comically at the end of the movie."
"Juliette Binoche is devastating as the mother, desperate for one last glimpse of her son, and Willem Dafoe is oddly perfect as the cowboy who allows her the chance."
"The dragon lord (Jacky Chan) and his buddy, cowboy, totally made the movie fun, meaningful, and just plain silly."
"All the other girls think Floriane a slut, an illusion she encourages in the men and boys she teases, because it leads them on."
Having had someone steal her Gameboy and Gauntlet II game from my Mothers car she gets concerned about other thieves stealing her other toys.
That Brooks's character decides to leave her boyfriend (even if she does reconcile with him later) is also a little ahead of her time.
Boyer just doesn't fit the romantic leading man role for me - so he and Bacall together was a little strange.
"On top of that she is apparently schtupping every boy and man in sight if they can be of any use to her at all, from the handsome but dumb Francois to the bus driver she wants a favor from."
"For those unfamiliar with this show, Pushing Daisies centers around a man named Ned (aka The Pie Maker, played by Lee Pace) who discovered a special gift when he was a boy: He could bring the dead back to life with the touch of a finger."
"It seems that Matthau's Einstein is living in Princeton with his niece Catherine Boyd (Meg Ryan), and she is seeing a stuffy professor named James Morland (Stephen Fry)."
None the less his attitudes towards a little boy who comes to work for him and the convicts is complex.
Alan Shore's flamboyant and gratuitous public service announcements where he spouts off his opinions do not impress.
Stardust is a fun film and has some fun performances from the likes of Claire Danes as the star(I could gaze at her for quite some time) to Michelle Pfeiffer(I could gaze at her at full magical powers even longer) playing the horrible witch to Robert Deniro playing a nancy - boy air pirate to perfection.
"It does drag at points, and the central story shifts from Boyer completing his mission to Boyer avenging Wanda Hendrix's death, but Graham Greene is an author who is really hard to spoil."
"An anonymous clubgoer has a fatal threesome with two vampires, the Satanist and head vampire get it on with some kink, Lutz finds an English pal, and Celeste and her boyfriend make love."
"He uses a magic mind - control helmet to do this, which the college boy willingly puts on his head, and then at several points in the movie, takes off and puts back on."
"Boy, is she so convincingly evil here as a witch, especially with her age - ugly makeup in the beginning and end!"
"Or Idrissa Ouedraogo's part (which features a bin Laden - double so much resembling the real one that you'll be shocked when you see him, I promise), in which 5 boys muse about good things that can be done with the reward put out on Laden."
