"He charms them with his humor, telling them not to rob him of his first big case, and that they are as good as lynched with him as the boys lawyer."
"The little boy gave a very good performance, he's very cute and the best feature of the film."
"Feeding off atomic energy, it immediately goes on a rampage, and the world wants to destroy Gamera once and for all, but a little Japanese boy named Kenny, who has a psychic connection with the giant turtle and even keeps a miniature version in an aquarium by his bedside, believes Gamera is essentially kind and benevolent."
"He's got everything down, I'm sure, with storyboards, and he creates some memorable impressions with some compositions (one of them is when all is said and done, and Tadashi and the' other' human character are in the middle of the Tokyo rubble in an overhead shot), but the CGI is sometimes a little unconvincing with the robots, and the interplay skirts on being TOO flamboyant, and some visuals, like the overlay of the Yokai spreading the word about the big festival on the map, just seem weak and pat."
"And, of course, we can't forget that she's got eyes for one of the pretty boy preppies who is dating one of the obnoxious teammates, nor that she doesn't have a steady boyfriend (although Keanu as Tommy later enters the picture)."
The sit com take off involving the single girl and her boyfriend was just plain bad high school humor.
Paul Naschy (who I must admit looks quite hot here) plays the honorable priest who gets approached by John Gibson because his sister Leila's behavior changed drastically since she met her new boyfriend.
"Our boys would never take a slut like that down to the basement, rape her, and subject her to such sexual humiliation."
"She suffers the pretty girl's fate of being not a person but an object, and she can't resist the validation the boys give her by wanting to kiss her and bed her, but she doesn't really care about any of them and knows her involvements with them are a trap."
"At least the boyish O'Neal is sincere in his weakly defiant approach, but MacGraw is so wooden and smirky in behavior that it's hard to see what Oliver sees in Jenny beyond her sarcastic facade."
He finds himself watching after the boy who lives with him because he really wants to join in the Mexican gang that keeps tormenting his family.
"An amiable rancher (Norton) wanders into town and charms a young girl (Evan Rachel Wood), seemingly rescuing her from a dead - end existence with her bad - tempered father with a whirlwind romance, but it gradually becomes apparent that there is more to this cowboy than meets the eye."
Nancy can't sleep over at her friends' house because her boyfriend is coming over for dinner.
"Boyer is a fine actor, but he's not Bogie, and Herman Shumlin is not Hawks."
"Della escapes in her car and rather than choosing a police station or well lighted safe area, she drives to a construction site, where she kills all four bad boys one at a time with simply the tools (literally) at hand."
"In another scene, Rider Strong from Boy Meets World gets bitten on the hand by some kid who only says Pancakes and likes to do karate kicks on those who sit next to him."
"Charles Boyer is supposed to be Spanish, and he's come to London to buy coal in Confidential Agent, a 1945 film also starring Lauren Bacall, Katina Paxinou, Peter Lorre, Dan Seymour, and Wanda Hendrix."
At the end the other Indian boys in the village attach the feathers to Tutazema and he becomes an eagle himself.
Most of the movie doesn't even have any action and shows the developing relationship with the Princess and the farmboy / terrorist and his disturbed sister.
"Twenty years ago, the five years old boy Michael Hawthorne witnessed his father killing his mother with an axe in an empty road and committing suicide later."
My favourite scene is where the boys are playing football and Christy uses his head to stop the goals and then kicks the penalty!
"I was most disappointed with the ending of the film and the resolution of the character's relationships - Mikaele was the player who only messed around with white women, comes to slightly turn his ways when the' Dusky Maiden' comes to town, has an epiphany that maybe he should start looking for a stable relationship, then at the very last minute rejects it and accepts his position as a Polynesian Playboy for palagi women."
"This progression takes many turns, from a blind, vegan, meat salesman that he berates to see whether he can get him to explode; to a phase two donor - necessity heart patient, unable to print her line of stationary, or even run with her Great Dane Duke; to an abused and scared Latino mother of two, too afraid to leave her boyfriend; to a dying hockey coach that instills faith in a downtrodden youth community; to a little boy in need of a bone marrow transplant."
"i also thought it was funny how Libby was popular but she was always jealous of Sabrina, and never seemed to have a real boyfriend but was always wanting to be with Harvey."
"4) I forget his name but the villain in this movie is wonderful, and his How's it going', Buddy Boy?"
"As the boyish Thief, Sabu is perfectly cast in this, his third film."
"I had a vague idea of who Bettie Page was, partly due to her appearance in the very wee days of Playboy (apparently, when she got her photo taken of her and her Santa hat, just that, she didn't know what the mag was)."
He stays overnight with a beautiful woman Christine (Renee Soutendijk) and has sex with her (by imagining she's a boy).
"Who wants to be promoted so the crew will take him more seriously Given that the cast also includes Jack Palance at his most dementedly OTT, Charlton Heston at his most rigid, top - liner Tim Matheson at his most anonymous, the original Hills Have Eyes' unforgettable Michael Berryman (you may not remember the name, but you DO remember that face) and Peter Boyle as the industrialist out to sabotage the mission because, er, if it succeeds the world will be saved but his share price will go down, you'd expect if not a laugh - a - minute at least a laugh every reel."
"And at the films sastifyingly painful conclusion, he finally learns what it means to be a real boy as his Blue Fairy Godmother grants him his wish."
"Boy this guy is right, someone does hate cats and with a deduction like that he should be a policeman."
"Hoffman may have begged for change on the streets, but some of the users point - out that Jon Voight was not a major star for the filming of Midnight Cowboy - his actual salary would surprise you."
And it is hard to keep a secret when her jealous ex - boyfriend had him followed and photographed.
Then there are the mandatory 8 mm film childhood flashbacks of young Joey dutifully moving the lawn and cowboy dressed Franky jumping on his back and wrestling him and yadda yadda so we all know what deep bond there is between the two of them.
"There is topless scenes for no reason and a guy in it who my boyfriend says is a well known wrestler but his part is completely unnecessary, obviously they made something up just to put him in it because then maybe wrestling fans will actually watch this pointless movie."
This is a fantastic film about a quite gifted boy / man with a special body part helping him.
"One White boy (Lukas Hass watching his career go down the toilet), one Black, one Asian, and one Hispanic."
"She becomes very self aware and strong towards the end, even finding she doesn't hate boys as she so defiantly claimed at first."
The Major at a boys military academy is paranoid that every kid is bad and wants to cause trouble (in this movie he is right).
"Its so cool to see those posters in the bedroom of that boy (Judas Priest, Lizzy Borden, Raven, Twisted sister...)and his vinyl collection(unveiling the wicked by Exciter, Rise of the mutants by shock metal master Impaler and Killing is my business by Megadeth)."
"After Ms. Grandin is abducted by dealers in the buying and selling of women as prostituted slaves, Ms. Gail and her policeman boyfriend Matt Moore (as Larry Burke) must rescue the virtue - threatened young woman."
As she befriends the boy she realises that her imaginary world that she created is actually better than the real world that she is in.
One night Cassie and her friends decide to go to a wild party with plenty of drinking and dancing and Cassie is riding with her boyfriend who she likes but never told him she loved him.
"But boy will those kids watching it learn: even now I can clearly remember Dr. Baxter being challenged by Hemo himself to name what common material most resembles human blood, to which the Doctor immediately answers sea water."
"Despite his powerful presence, Cramer never upstages the Boys, a tribute to Stan and Ollie's beguiling charisma."
"Case in point - near the end of the duel, the banjo - playing boy was smiling (loved his banjo), but when Drew tried to shake the boy's hand after the duel, the kid was too reserved to respond."
There was also a very charming performance by Harry Watson as a devilish little boy who did everything he could do to play cupid--all because he wanted to win a bet!
"The story itself isn't bad; it's about a young French boy who is treated unfairly by his parents and his teachers, and eventually he ends up in a juvenile facility."
Now I see why her boyfriend killed himself.
"single cute girl needs handsome boy to impress ex, pays him and then (guess what? )"
"He also shows the boys his success, turning the duckling into an egg, and he next proposes to use a human subject, i.e."
And thus he wrangles the boys into building his saloon at the rate of 15 cents an hour.
Sonny boy wants to be his own man and dad wants to pull him into the casino (Caesar's Palace!
"( Maybe to Bach's boyfriend, because think of it where's he gonna stay?)."
"( I also took my little cousin, who's a little younger than the boy in the movie, to see it after I saw it for the first time, because he has issues at home and I wanted to use this as a way of starting a discussion on father - son issues with him."
Duncan himself looks more like a motorcycle hood than a boy wonder-- in fact he's more like a guy in his thirties waiting for Lowery to kick off so he can wear the big cape.
"Anna begins visiting the boy and the house more frequently trying to figure what's what and in the process tries to help save the boy, but her fever is making it harder for her to wake up each time and may not only kill her, but trap her and Marc there forever."
My boys (6 and 10) both LOVED it too--oh and my 45 year old boy had a smile on his face the whole time.
"To listen to Darius laughing from being in the water at Panama City, to see his trepidation of being too close to alligators in Louisiana, the wonder in his eyes as he rode in a hot air balloon, the excitement of rafting through some rapids, the bet to eat a spoonful of wasabi, and the phone calls home, and as always - boys will be boys."
This portrayal of Victoria shows that she was a rebellious young woman once - I'm sure she would have been on Jeremey Kyle Show if it had been around then: My mother and her boyfriend are trying to steal my life.
"The funniest moment in the movie comes when a young boy imitates his father, whom he heard earlier in the day yell out ` MotherF * * * * *', while in the classroom."
"The zombie earns Timmy's love when he rescues him from a pair of violent bullies, and the two form a bond to rival the classic boy - and - his - dog cliche...a boy and his zombie."
"When a jealous boyfriend steps in, trouble brews for Curly and the life she s known may be torn asunder."
The boy playing William did a good job as well though I didn't find him convincing in every scene.
"From the new eyebrows to other parts of her body, Ms. Boyle is hardly recognizable as Col Kennedy, the character at the center of the mystery."
"It was up to Ross and Simon to tone down the character, to nuance his temperament to give The Sunshine Boys some sunniness, yet Walter continues to project as if we'd all gone deaf."
"Being a baseball player myself, it was quite painful to watch Frankie try to hold her own on a team of boys, but it does a good job of showing the struggle she faces."
"Gruanted they think it's the daughters boyfriend, but after 10 minutes of not talking you would pull the mask off and ask him why he's not saying a word."
"It's really about the moment when a boy awakens to the fact that the small circle of people he knows actually live in a much larger, much more complex world that he doesn't yet understand.the script is strong and filled with humor, the direction is crisp."
"If you have a high school student still drawing cowboys I'd think him to more likely be gay than a high school student who draws crows) and later, kills Lester, in a cornfield, under the titular scarecrow."
She wants to get famous and makes up a boyfriend to let news reporters be interested in her.
"Pretty boy Larry Seymour plays the no good man but after Lena threatens him, he might shape up."
The boy is slightly puzzled as to his parents anxiety as some of his friends have already done it already and eventually goes off to do the test.
"Still, this movie offers about everything - except Boy (their adopted son) - you'd want to see in a Tarzan film, even O'Sullivan doing her Tarzan yell about a dozen times."
"The cowboy spends the whole time in a state of unreality and depression . A total loser who prefers to go to the beach then work for living, and then commits a burglary on his family as he is too lazy to make money legally."
"After the boy was forced to leave the tribe for punishment after freeing the eagle, the eagle, too, saved the boy's life and more than that, taught him how to survive."
"The heavily drugged captives consist of her old boyfriend who raped her, a grabby neighbor, and her sexually abrasive boss."
"A boy named Alex played by Denis Lavant (who plays a character named Alex in Carax's next two movies), has just been dumped by his girlfriend who has fallen in love with his best friend."
The film's main thrust is how a boy's temporary excursion into the Canadian wilderness after surviving a plane crash solo allows the disgruntled adolescent to deal with his anguish over discovering his mother's extramarital affair.
Cassie dreams she is being made love to by her boyfriend after he died and finds another guy in her bed and is told she was asking him to make love.
This tale lacks the all - important transition from I'm a straight boy smacking my guy friend around for fun to I think I might be gay and hitting him because I'd like to spread his ass and do him S / M style.
"Kristen was a good girl, her boyfriend (omar epps roommate) was a good guy, and even Remy was a good guy, he was just misguided."
"Enlisting Marie to act as her pal so her (unseen) mother won't know she's going out to meet boys, she also gets Marie to rescue her from the boys later."
"But Melvyn doesn't seem too bothered either way . He spends most of his time trying to get into the pantaloons of his sweetie, played by Faye Wray . Also in this mix is the town simpleton, played by Dwight Frye, who always seemed to have played the same role in every movie he did . He further freaks out the townspeople by catching bats and drinking his own blood . Lionel Atwill plays the town doctor who seemingly is trying to help the constable solve the crimes . And boy does he ever stink as an actor . Atwill is as close to cardboard in this role as he could get . And Lionel Barrymore is also in this thing .... lots of big names to be such a pile of guano."
"The girl who has a father in exile in Italy and is awaiting a passport for her mother and she to travel out to join him, the piano that is taken away from communion use from one of the boys, the sudden giving of your home and quarters to your new comrades because they need it."
The movie tells the story from Jimmy being boy to playing in his first game in the majors.
Leire (Najwa Nimri) is a shoe designer with problems and loses her boyfriend; Maricarmen (Vicky Pena) has lost her husband and now raises the children from his deceased former wife.
"Terrible story, poor acting and no humour at all (apart from the final joke at the end) Some sort of ugly angel is sent to earth to save a boy and his mum from being thrown out of their home."
But nine months later he is summoned to the wall breech where the old guard hands him what you might expect - a baby boy.
One (the good boy) pleads for her to see the error of her ways.
Nearly the whole movie is set in a prison cell revolving around 4 characters of which transvestite Marcus and his little retarded boy are way out the strangest.
His comedic timing is excellent and he has the chance to do some really great impressions (he wasn't kidding when he said on the Hellboy movie commentary that he needed an intervention when he gets into Jerry Lewis mode).
"The rest of the film is devoted to Laurel and Hardy's support of wealthy patron Trudy Marshall and her inventor boyfriend, Robert Bailey."
"Denver Pyle's Uncle Jessie was also the moral center of the family, always insisting that the Boys do good, even at their own expense or embarrassment while he made sandwiches and coffee for when the chores were done."
He literally kidnaps the boy and is able to convince a higher up that the child is better off with him than being in a boy's home.
A young boy sees his mother getting killed and his father hanging himself.
The eldest boy has been taunted that his mother is a prostitute and none of his siblings have the same biological father (which Kurosawa makes obvious by having children who look nothing like each other).
"The boys decide to clean up the mess, and when Stan tears the carpet with the shovel, Ollie asks Can't you do anything right, and Stan replies I have nothing to say, getting the shovel bashed on his head."
"It's a story of cops and crooks, or rather A cop, detective Tracy as he tries to bust Big Boy (Al Pacino, in what is arguably his BIGGEST performance to date, and in a sense the one that makes sense for his grandiose style), but with no such luck."
"Much of the humour is of the light family variety, and sometimes the plot line is too heavily reliant on the boy and his dog / family moments."
"All she needed was her lover boy, Kid Rock."
A young boy and his mother are away from home.
"The scarecrow then goes on to kill those who tormented him, those who smoke pot in the corn field, those who dig graves, boyfriends of daughters of gravediggers, pretty much anyone who showed up on the movie set."
"The movie begins with a young boy smashing a roach beneath his foot, a man who is nearby parking his car sees the young boy smash it and runs to ask the kid ` why?"
"When the boy turns away from Drew, who had offered to shake his hand after their stupendous jam session, Bobby tells him to give the kid a couple bucks, knowing that none of them are quite sure how to react."
"Anyway, that's my thought and if anyone has another reason I would love to hear it but back to the film itself it's apparent (and very sad) that a film like this could probably never get made again (except in Europe) because of the religious right and the other prudish freaks who just can't come to terms with the fact that a teenage boy getting laid will not do him any harm."
"Prom Night 2 is an OK horror movie but prom night is way better and this movies about how the prom Queen Mary Lou in 1957 gets killed by her boyfriend and comes back 30 years later for revenge . The best actor in this movie is Micheal Ironside and the movie stars other OK actors and actress like Justin Louis (I),Wendy Lyon, Lisa Schrage and Richard Monette(I).And there are some good gore scenes like when Mary Lou kills the girl that is trying to hide in her locker by crushing the lockers together and how one of the students are on the computer and Mary Lou electrocutes him to death . Over all this is an OK / good horror movie and my rating is 4 out of 10"
"But only boys are allowed to study, so after her father's death she decides to disguise herself as a boy to get in."
A boy fighting off spies / terrorists when he's home alone in a Chicago suburb with the chickenpox?
"That his son, played by Peter Finch, should become enthralled by the super image and enigma of his revered father, is not unexpected, since the son was without a mother growing up in a foreign jungle with only his father and his father's rowdy' boys' club' as his role models."
Could Floriane's sluttish behaviour with Francois and the other boys be just a device to hide her lesbian feelings from the outside world?
"The real tragedy is that the CIA's 1953 overthrow of the prime minister and subsequent backing of the brutal shah gave Ayatollah Khomeini an excuse to use his narrow interpretation of the Koran to establish a chauvinistic society, and that George W. Bush's current policy towards Iran gives Mahmoud Ahmadinejad an excuse to act the cowboy and tighten censorship."
Even after Pang steals a boat and takes the woman to his home where they are married and she becomes pregnant Wai follows and joins the evil man (who's training the boys)making a deal to fight and train so he can get Pang.
"Jill's problem with Liv is that she has taken up with Zack, a boy of questionable character, and they are constantly making out--in fact Jill comes home to find the two of them on Liv's bed."
"At that, Barker yells up to his mates, OK boys, he wants 'em rabbeted, so .... YANK' EM OUT!"
"Having witnessed his unfaithful wife Brooke (Linda Hoffman) getting it on with their pool boy, he determines to punish her."
The songs like One Boy and One last Kiss are really enjoyable to listen to and to tap your feet to Jason Alexander is the complete contrast to his character in Pretty Woman ans is very good.
Brady helps and he and Doolittle end up taking the boy back home.
"Elvis gets to sing just a few utterly worthless songs, and is pursued by a young boy - crazy gal and her gun - toting mother."
"He was so funny and played his character to perfection, an over - protective dad, who likes to keep his daughters out of the limelight and away from boys."
"After a series of mishaps and close shaves, he meets the Artful Dodger - superbly played by a young Jack Wild, who gives his all in the role - and through him, the greedy Fagin (Ron Moody), who trains young boys to pick pocket treasures which he keeps for himself."
"The boy born to the couple from the experiment constantly runs a fever of 100 degrees, and when he's an adult, people in his life start spontaneously combusting."
"Cassidy was the lead singer of a demons and death rock band who couldn't shake the sad feelings of her boyfriend's neglect towards her(you know, I can find other reasonable ways to solve this other than putting a bullet through your head)."
"We have the girl's ex - boyfriend and her parents * * * * -block the relationship at any possible means when things are looking up, not to mention the awkward family members from the main character's side...check."
One particularly nightmarish scene has a young latch - key boy wishing he had parents for Christmas - suddenly the port - a - family emerges out of giant Christmas presents - of - the - mind until he realizes he's just daydreaming!
Shahrukh Khan was wasted in his bad boyish type role.
The family's world flips upside down late one night when Dad rushes into the boys' room and tells them God has given him a vision.
He annoyingly calls him Buddy - Boy all the time and possesses the bodies of Logan's friends and colleagues in order to trick him.
The pathos of the little boy and his beloved yet sadly insane father is most touching.
"A film that dramatized an understandable reluctance to face the inevitable coming of the the second world war, when a Spanish Republican, sent by his soon to be overthrown government, (Charles Boyer) infiltrates himself into England looking for support for his cause by trying to influence wealthy mine owners not to sell coal to the fascists back in Spain."
"Later he would appear in the film The Invisible Boy- included in this DVD as a bonus, as well as several appearances in the 1960s sci fi TV shows The Twilight Zone, Night Gallery, and Lost In Space- with whose own robot he is often confused, and a cameo appearance in the 1984 film Gremlins."
"However, her character's fatal flaw is its willing to believe what isn't there--that her boyfriend wants her to succeed--and this is what leads to her end at the movie theatre."
"Preston Waters, a 11 years old boy, has problems with his parents and brothers specially because of money issues."
"He's certainly been wonderful in plenty of lighthearted roles, but I guess I always put his success down to his characters' grumpiness and ruthlessness, a gruff contrast to the flamboyant personality of his frequent co - star Jack Lemmon, and, I suppose, a natural extension of his earlier work in dramatic pictures."
"First of all, this must be a new definition of without consequences of any kind because, in spite of the fact that Ned was only a boy and did not realize that he had caused the death of Chuck's father, he nevertheless felt guilty from the moment he realized what he had done."
"And speaking of Chris Lybbert, who plays Hopalong, check out his duds (if you dare to watch this film): He wears these brand new clothes that make him look more like Roy Rogers than a hard - working, down - and - dirty cowboy."
Then we enter the music world (punk was a new variety of music at the time of this film) where D rate bar performer Rootboy Slim performs boogie till you puke in his own lazy style of dirt and eclectic sleaze.
"The idea of a girl manipulating a dream world with her drawings (thusly the dream world manipulating reality), and also connecting with and affecting the life of a boy she's never actually met, is fascinating and never disappoints."
