"With Randolph Scott, and his jaw, as Colonel Thorwald (Carlson) leading a unit comprised almost entirely of stock caricatures, the green recruit (Harry Landon, Robert Mitchum), the grizzled veteran (J. Carroll Naish, Milburn Stone, Sam Levene), the country - bumpkin (Rod Cameron), the all - American boy (Alan Curtis), and scores of sneering (when they weren't laughing )' Japs'."
"At first i didn't think that Ben Affleck could really pull off a funny Christmas movie, , boy was i wrong, my daughter invited me to watch this with her and i was not disappointed at all."
"Boyer is Luis Denard, and everyone is out to stop him except Bacall."
"On the one hand Trelkovski seems so nice and even cute in his shy behaviour, but on the other hand he beats this boy on the playground and there is no explanation for that."
"So in summary, I'd recommend checking it out for a little Friday night entertainment with the boys or even your girl (if she likes to see other girls get it on! )"
"A little boy comes back from the dead and manages to kill people with what looks like a tiny scalpel, and not only that, but he manages to lift their bodies and in one case, carry a body from the ground to the attic! (? )"
"When the boy of the estranged Savage Family is run over by some city slicker tourists, Pa Savage wants revenge, and he'll stop at nothing until he gets it."
We are shown the series of struggles from boyhood on that Brashear has to overcome to make his dream come true (and then to keep it alive . )
"A girl who is treated like a whore by her super - jealous boyfriend (and still keeps coming back), a female teacher who discovers her masochism by putting the life of her super - cruel lover on the line, an old couple who has an almost mathematical daily cycle (she is the official replacement of his ex wife), a couple that has just divorced and has the ex husband suffer under the acts of his former wife obviously having a relationship with her masseuse and finally a crazy hitchhiker who asks her drivers the most unusual questions and stretches their nerves by just being super - annoying."
William Boyd must be spinning in his grave.
"In conclusion, I would like to praise screenwriter Laura Jones for her stunning dialogue, director Gillian Armstrong for her understanding of actors, and the great Russell Boyd for his brilliant, understated cinematography (please see his work in Tender Mercies )"
Wait' til you see him in Gangs of New York before you call him nothing more than a pretty boy.
"Seeing it again made me appreciate it more, it has some overall good effects (for its time) and the story involves a mute boy and his dog, and an evil businessman person who wants to kill the YETI for his own purposes."
"Boyer's mission never succeeds, as he has too many hidden foes all over the place."
It would have been nice to have seen a little more into the movie about the 2 sisters knowing about each liking the same boy before he was killed off.
"Sinatra gets to show his versatility and why the girls swooned over him, with those big blue eyes and boyish face."
"She gets some bad advice, hangs out with some bad boys and apparently family planning wasn't being taught at her school."
Numerous Playboy spreads and bad movies like this one (this one in particular) directed by John destroyed what momentum she had and made her the butt of many a joke.
"After failing to obtain gainful employment, Michael stumbles into the Red Rock bar where the owner Wayne (J.T.Walsh) mistakes him for a contract killer he summoned from Dallas, hired to do in his lovely but lethal wife Suzanne (Lara Flynn Boyle)."
Cassidy(Kacia Brady)puts a gun in her mouth blowing the back of her head out on boyfriend Neal(Jason Dibler).
"Adding to what I just said, the kid's mom is promiscuous, he walks in on his mother and her current boyfriend getting it on, mom's boyfriend tells him to leave, kid refuses, insisting that he isn't going to leave his own house."
"In it, a drunk guy bent on killing Frankie - boy somehow manages to find him in a carnival of all places!"
"This flick is just too much as Keaton's daughter, Sara, dies in a traffic accident, while her boyfriend survives."
"The silly seductive tale of an Argentinean rich - boy who was so shocked by poverty he became a Robin Hood fighting alongside the poor, until eventually he was murdered by the CIA."
"What a glamorous figure she cuts in her swim suit, sauntering around, teasing the boys, swishing her long blond hair."
"However, Williams' ex - boyfriend (nice job from Bobby Cannavale) raises doubt about the boy, which prompts Williams to arrange a meeting with him in person."
"But the killer has escaped and still has Donna on his mind, he follows her to her prom which means bad news for her friends, and the hotel maid, and the bell boy, because it is such a good idea to kill the maid and bell boy so no one become suspicious enough to check to see where these employee's are."
"He is lingering in his boyhood, while the reader discovers his wife is an unbearable, aspiring socialite who wants him to resume his place in society."
Her boyfriend does not show up and she ends up being helped by the witness.
Most of the flashback scenes were lifted directly from Burt Ward's book Boy Wonder: My Life in Tights and I imagine his book was the inspiration for making this movie.
"A boy at school has to attend a lesson when his friend plays truant and is given the most important lesson of his life, only to find that when there are not enough copies to go around he has to share with the school bully."
Jane's duplicitous actions tricking Tarzan and delivering Boy to his family.
An average 8 year old boy would take her apart on this showing.
"Boyer is terrific in his role even with the wrong accent, but Bacall is 100% American, not of the British upper class."
"Boyle seems to be taking his cue from Gene Hackman as Lex Luthor in Superman, apparently he's the only one in the cast who realizes he's in a turkey and overacts accordingly."
"For example, the' creaming' I guess you would call it of Cindy (Anna Faris) was funny in Scary Movie because Cindy had been holding out on giving her boyfriend sex for so long, that essentially he had blue balls from hell and it was funny when he' creamed' her."
"On the next morning, Gerard sees the picture of Christine's boyfriend Herman (Thom Hoffman) and he recognizes him as the man he saw in the train station."
"There is the American Indian legend, but when looking at the scene where the young boy hears about about it, it is explained to him like bluntly and simplistically."
It is touching and beautiful to see this bond between the young boy evacuated from London and the grumpy old man he is left with develop - a real grandfather / grandson connection.
As she forgets to draw his legs (because he is sitting behind a window) the boy cannot walk.
"Also, the young woman is a little funny in the head, and this is corroborated when we discover she has been seeing the boy's father, who is a psychiatrist."
"On his death - bed, Palance finally tells our boy hero his last name (while wearing a horrible bruised makeup job that makes it look like somebody put a balloon under his eyeball), which he kept quiet about before."
"Only the Boys get screen credit, but movie mavens will recognize other familiar faces: James Finlayson appears as a loony doctor, Richard Cramer does full justice to his bad guy role, sweet Mary Gordon plays the Boys' perplexed neighbor."
"When Anne Bancroft's son catches Van Heflin in his uniform just before the raid, I expected the boy to think it was Halloween."
"Another extremely funny and surreal scene is when Trudie Styler (Mrs. Sting herself) and another actor perform a scene on a cable access show, from the film the boy in the plastic bubble."
"After learning that the boy has died, he is confronted by the abusive father who, fearing his testimonial, tells him he didn't see nothing, doesn't know anything, and not to say anything, and that if he does he will kill him."
Chris Makepeace is a boy genius named Jay Jay and the best thing about the movie is that he wears a succession of funny hats.
One episode had been about an emotionally troubled 12-year old boy and the other was about a vibrant young man (Clu Gulager in his best performance) who is dying of cancer.
"The boys then fool around in the studio, put on Miss Van Doren's record and Curly gets dressed in women's clothes and pretends he's singing."
Louise Brooks here plays a character less flapper than what she was known for: she's a stenographer who on a lark decides to enter a beauty contest despite the furious opposition of her extremely smothering boyfriend.
It is a wonderful story about the love of a boy and the eagle he took care of.
This hunky boxer is somehow traumatized by the persistent attentions of a fleshy momma's boy who works at his gym's parking lot.
"When Leo goes to Paris for treatment, he takes Marcel with him but the young boy confronts Leo and demands to know the truth."
The boy is after a sweet girl that he has a crush on until he turns into a sleepwalker and then he just wants her body.
"One of her credits was as executive producer, with a producer credit going to her then - boyfriend and former hairdresser, Jon Peters."
"Or, seeing that boy drinking what is obviously not his first beer, being all of what , 10?"
"Astaire attempts to break free from his typical rich - man - about - town persona, without much success, but it's hard to imagine the performer without the boyish carefree charm that could only accompany being considerably wealthy."
"Little does she know - though we learn immediately - that the employment agent is a front, set up to get just the right woman for this assignment, a woman with no family and no boyfriend."
Kimi wa petto is a cute story about a girl who one day finds a boy inside a box that is outside her apartment one day.
"The boyfriend and the woman speak to each other outside and he, broken - hearted, basically decides to let her go and breaks up with her."
"Synopsis: A bunch of emotionally immature uptight prejudiced colonials mistreat their slaves, and a little girl gets hurt by her only friend when the house - boy finally gets fed up and takes his abuse out on her."
"Presumably, after the success of Dodge City, Warners tried a follow - up with Errol Flynn and his usual list of buddies, like Alan Hale, Guinn (Big Boy) Williams, Frank Mc Hugh and the ever - present John Litel, but they made the huge mistake of trying to present Miriam Hopkins as a love interest for Flynn v. Randolph Scott, and as a singer to really make things bad, because she proved one thing, and that is she cannot sing."
She is understandably non - plussed by all of this and forced to befriend a creature who is almost as monstrous as her boyfriend.
Tobey Macquire is cast as a young German farm boy who is derided for his heritage because the Germans were supposed Union sympathizers.
"If by any chance you should wish to read a book about schoolboys who did buck the system rather more successfully than Mr McDowell and his friends and furthermore lived to tell the tale, find a copy of Stalky & Co.written by the man whose much - maligned poem If lent it's name to Mr Anderson's film, a man born in colonial India, a man whose work is quietly being airbrushed out of our literary history . And do it before the chattering classes succeed in declaring him a non - person . Perhaps somebody should start a revolution about that"
He makes it quite clear in an early scene that he used to be a chorus boy.
"Additionally, other aspects, such as her giving the young Morman boy, oral sex, or that she would actually make a good assistant to the vet, who coincidentally happens to have a thing for her mother, etc ., all these elements just did not really help this movie along."
"What is great about Batman is the diversity of his skills and aspects of his personality: detective, crime - fighter, playboy, philanthropist etc."
"The accuracies that should have replaced the inaccuracies, as far as I've heard them, include: number 1 ., Parsons was married at the time of his death and even had a child, so what the hell was that all about with the girlfriend's and the chasing and whatnot?, number 2 ., Kaufman's drugged - out buddy was a known willing participant (unlike what the movie attempts to portray) in the disposing of Parson's body, and finally number 3 ., Gram Parsons real - life father died when he was just a boy, and so it was Parson's step - father (who could have honestly cared less about Gram Parsons when he was still alive) in real - life that took care of the body after it was torched!"
"A kleptomaniac high society lady with a fattish to smaller shoes, a burlesque house madam taking care of her disabled daughter, a drug addict dancer obsessed with her former boyfriend and a taxi - driver taking care of her late husband's disturbed kids, all roaming the streets of Madrid in well designed scenes."
"At times you wonder if the real or the occult world depicted here is stranger...when the retarded boy looses his fingers and is lulled to sleep sucking on Marcus breasts it seems normal, so how strange can glowing gates to freedom be?"
"Many decades later, the old man has raised three children (two boys and one girl), and allows his son and daughter to marry and have children."
"There's a lot of spliced - in, second - long snippets of Vegas traffic, casino crowds, and even a scene where the Robert Drivas character is having a conversation with his father about how much he's grown up, and without any explanation, he (Drivas) goes (in those infamous snippets) from being himself, to a baby, to a little boy, and then back to himself while talking back and forth with his father."
"They meet a little boy (Dean Stockwell) and on taking him home, they meet his aunt (Grayson)."
"The young man, still a boy, is played by Jake Gyllenhaal, one of his first staring assignments, I think."
"What with her germaphobe surgeon beau in New York, her playboy with gangster problems in Miami, and her creatively challenged rock star dude in L.A., Tara sure does keep busy."
One of her boyfriends is played by Sam Melville (from the TV show THE ROOKIES) using a different name.
"meaty role as Megha, a girl who has run away from home and is waiting at the Delhi marriage registrar's office for her boyfriend Dheeraj (Shayan Munshi) to meet her."
Jessica had her 17 year old boyfriend Douglas Christopher Thomas shoot and kill her parents!
"The cat catches the fish, drops him back in the bowl and exits through the window he came in just as the boy, not knowing what has happened, gets back."
Pretty Boy Floyd meets his demise dramatically.
when i hear about john loesing his son i start thinking about when he made urban cowboy he was 26 or 25 at the time
"Val has the perfect life, she has a boyfriend and a perfect apartment of the Upper East Side."
Boy she sure came a long way: from flower power to I'll take mee clothes off for a shillin'!
"Note to BSG fans, the boy playing' Willy Adama' doesn't really look much like Olmos, but he's just a kid."
She and Eddie resume their relationship when Sarah calls things off with her current boyfriend who is also shagging the lady of Walt(Bill Sebastian;Eddie's best friend who recently paid for his cheating girlfriend's boob job).
I watched it expecting a campy love story and instead I got some boring student project about some idiot who has to find the strength and courage to marry his boyfriend while his annoying Christian brother tried to destroy it all!!!
"An earlier work of Miike's, Shinjuku Triad Society is still filled with his usual in the ol' ultraviolence and sadistic sex acts, though it's not one of his more eclectic or flamboyant pieces."
"Two days later & Ray (Travis Quentin Young) along with his sister Dawn (Erica Hoag), her boyfriend Nick (Craig Bonacorsi) & four of their friends pull up outside a cosy log cabin (The Evil Dead style ...) with a view to a relaxing weekend in the wilderness."
"And when the film climaxed in an orgy where the boy drinks both his mother's milk, as well as that of the woman he has been lusting after for the whole film, I almost vomited with disgust for the total perversion and sentimental pap that it is."
"The girl finds out that a maniac took her boyfriends camera, tries going to police, that fails, and then she thinks of the best idea ever."
It also has encouraged my daughter to start reading the original Nancy Drew mysteries which I am sure she will love much as I loved the Hardy Boys.
"Brendan is a young boy in Kells, a city surrounded by enormous walls, built by his uncle to keep out Vikings."
"The boy leafs through the book, his dad doesn't like his doing that."
"To have a chance at obtaining an education, Babs enthusiastically disguises herself as a boy which isn't the most difficult thing to do since she already looks like a boy, anyway."
"Jude Law plays Joe the Sky Captain with a dashing accent and plenty of over - the - shoulder, heart - melting smirks, but you can't make something out of nothing, and even his flippant deliveries and boyish good looks can't save the movie's stone dialogue."
"Anders works wonders with the part, and is photographed to look bizarre, while his scenes end on odd, sour notes, and are often choppily edited; but for all this he manages to make Grisby's derangement palpable and disturbing, and anticipates, in a genteel way, the more flamboyant Method actors of the fifties, such as Timothy Carey."
"As Cassie was driving, a car was stopped in the middle of the road and she was unable to avoid an accident and as a result there is a bloody loss of lives along with her boyfriend."
Playing a traveling rodeo cowboy Wayne holds up the rodeo box office at gunpoint and takes the prize money he would have won if the attendance proceeds had been good - the other riders have to settle for 25 cents on the dollar (actually even less after Wayne robs the box office).
"She was only brought to St . Petersburg to be a wife and mother, and found she had to bond with the dvoriane, the boyars, and the military just to survive."
"My son was 7 years old when he saw this movie, he is now on a Russian Fishing vessel and said that the movie he was most impressed with and that has lingered in his mind all of these 39 years is the movie of The Legend of the Boy and the Eagle."
"He was extremely underpaid for Midnight Cowboy, because he was unknown, but demonstrated that he could do that role at the drop of a hat."
"however, the story of the woman with the abusive boyfriend and his drunk friend really hits like a ton of bricks: very eloquent storytelling, incredible performances, and to think the scene was improvised."
"Going beyond Keira, which in this movie is a real tomboy, pretty much different from the lovely action figure we're used to see, Mickey Rourke is back, with his usual slap - throwing face and his potent body."
"As for the modern part between Toni Collette and her sister, her fear of commitment, her jealousy of her sister's perfect life, her sister wondering if she's made the right choices, her pregnancy and her too - perfect boyfriend (which actually might have been more interesting and meaningful if played by Patrick Wilson, and Ebon Moss - Bachrach might have been a more interesting Harris, given his dreamy eyes )--anyway, all this was hashed over in the 70's and 80's."
"But Dame May Witty, oh boy, she even had me doubting my own eyes and believing she could get away with her evil schemes."
"He really just wants to be a good boy, to do the right thing, and to make his brother proud of him."
Other Classic Scenes include Ramone Maroney butchering the English language Danny Devito urging Griffin Dunne to' Play Ball' Peter Boyle thinking he lost his manhood The fake VD movie This movie is no home run.
"Meanwhile, young Ray has grown attached to Connolly (the boy and his zombie are like TV's Timmy and Lassie) and, the Robinson family find it difficult to cooperate with the controlling Zomcom authorities."
She first of all decides to leave her present boyfriend (in shrieking hysterics) because she wants a child and he believes they're too young.
The boy survived the fire and he has hidden himself in the mall to avenge himself.
"I'm not a big fan of Boyle, and it seems that no matter what the mood during the movie, she's always trying to use her over - plumped lips, and darkly makeup - ed eyes to make herself seem super sexy."
"Grade school children sang his praises, and young German boys received training and indoctrination in military camps."
He was quite terrific in Boys n the hood (1991) - I've always considered his amusing role of Furious Styles as his very greatest achievement.
"Even when you know Bourne will escape the authorities (and boy do these films spotlight the police as inept), it's still brilliant watching him do it."
"While he's gone, the boys decide to test the formula for themselves, but Ollie ends up being knocked by Stan into the water tank with all the formula."
"It was really creepy how the killer was pretending to be the little boys friend, so he could kill."
Therefore we know in our hearts that the evil brothers won't take the throne but the innocent boy who manages to overcome every obstacle and difficulty he encounters during his journey.
"Toward the end of the movie, the mother asks her daughter what she can do to make up for it (for having slept with her boyfriend), and the daughter calmly says that she has thought about it and would like to hit her."
"Director Danny Boyle has lost none of his predilection for raking in the gutter of humanity for characters but he has lost, in this film, the edge for creating inspiring and funny films."
"Simpson as a all american soldier turned all american bus driver who decides to rescue his passengers on his own just incase no one else is going to and Arte Johnson in an absolutely straight role as the tour guide who doesn't know what to do but doesn't want to admit they are in trouble and combine it with Lorenzo Lamas as one of three baby faced bad boys who intend to kidnap an heiress and leave a busload of people to die on the dessert and you have got to have action, plot twists and a lot of drama."
"Chris Sarandon is also very good as her boyfriend, a successful lawyer, and the supporting cast includes many big names, such as Christopher Walken, Jeff Goldblum, Jerry Orbach, Beverly D'Angelo and Tom Berenger, before becoming really famous."
"He plans to leave the next day, but gets a look at a picture of Christine's hunky boyfriend Herman (Thom Hoffman) and decides to stay to have a try at him."
"In Cliff Notes version, here's the story (don't worry, I'll try not to give anything away)... A film crew travels to a remote island to film a documentary about two surfers (established cute boy and his buddy) who surf with sharks."
"The uplifting, good ones: The Mime sequence, the cemetery, the Montmartre (though it left too much to the viewer to comprehend), the Cowboy vignette, and the Sacre Coeur-- seemed few and far between, and I would have liked to have seen such a wonderful actor as Orlando Bloom be in something that would have showcased his originality more"
She carries her own brand of magic that even the special effects boys at Disney couldn't top.
"There's no great revelation or drama on the way, but things get a bit more interesting when it emerges that Marie doesn't just admire but truly desires Floriane and is jealous of her boyfriends--whom Floriane always stops before they go all the way."
"Basically you had this very slow pace and this naturalistic style of acting, but it was all there to prop up a very formulaic and predictable story, complete with all the trappings one would expect from any small town melodrama--everything from the boy cheating with his teacher's wife to the handicapped kid who everyone picks on."
"So this metal kid gets some powers and instead of using them to kill the bully boys (which would have made much more sense), he freaks out and tries to protect all of the bully boys and girls from harm."
"Then one of the boys asks, Why did he say ,' alley oop'?"
"Plus an odd Japanese monster movie cliche is included that will frankly annoy most non - Japanese audience members, and that is the adorable and precocious little boy who loves the monster and believes in him."
"The thin plot revolves around Headley's Gina McVey, her boyfriend, her father, her sister and her sister's husband who for some reason are being stalked, in a very louche and unenthusiastic manner, by their evil doppelgangers who emerge from mirrors that mysteriously smash."
"Inept, boring, and incoherent supernatural thriller in which college student Cassie (Melissa Sagemiller) is the constant victim of hallucinations and nightmares after a car accident claims the life of her boyfriend Sean (Casey Affleck)."
"The liberated French girl who will screw the 17 year old virgin boy because of her sexual generosity, the too much flesh guy who goes from getting off in cornfields by the mere breath of an Illinois breeze to helping deflower this same 17 year old farm boy?"
She lost her boyfriend in a fire at the site where the mall stands.
"At first it seems there may have been some racist aspects of the case, however it later turns out the main officer on the case was black himself and it seems he did some rather bad things to coerce a confession out of the boy."
"Basically, Ms. Simpson's Katie travels from a small town in Oklahoma to visit her boyfriend, to surprise him, only to find him in bed with another woman."
"He makes his own rules, does things his own way, all the while wearing cowboy boots and sidearms cowboy style."
She is still good enough to get boys' attentions but she also knows how present poise and self respect.
